2023,"Association between Plasma Brain-derived Neurotrophic Factor Level and Alzheimer’s Disease: A Mendelian Randomization Study",18755739,"Current Neurovascular Research","20","5",0,0,0,0,0,0,0,0,0,0,0,0,0,0,0,0,0,0,0,0,0,0,0,0,0,0,3,3,0,3
2023,"Observational and genetic analyses clarify the relationship between type 2 diabetes mellitus and gallstone disease",16642392,"Frontiers in Endocrinology","14","",0,0,0,0,0,0,0,0,0,0,0,0,0,0,0,0,0,0,0,0,0,0,0,0,0,2,1,3,0,3
2023,"Gut microbiota in combination with blood metabolites reveals characteristics of the disease cluster of coronary artery disease and cognitive impairment: a Mendelian randomization study",16643224,"Frontiers in Immunology","14","",0,0,0,0,0,0,0,0,0,0,0,0,0,0,0,0,0,0,0,0,0,0,0,0,0,2,1,3,0,3
2023,"Sex hormone-binding globulin exerts sex-related causal effects on lower extremity varicose veins: evidence from gender-stratified Mendelian randomization",16642392,"Frontiers in Endocrinology","14","",0,0,0,0,0,0,0,0,0,0,0,0,0,0,0,0,0,0,0,0,0,0,0,0,0,0,3,3,0,3
2023,"Positive association between omega-3/6 polyunsaturated fatty acids and idiopathic normal pressure hydrocephalus: a mendelian randomization study",16648021,"Frontiers in Genetics","14","",0,0,0,0,0,0,0,0,0,0,0,0,0,0,0,0,0,0,0,0,0,0,0,0,0,2,1,3,0,3
2023,"The causal association between smoking, alcohol consumption and risk of upper urinary calculi: insights from a Mendelian randomization study",16648021,"Frontiers in Genetics","14","",0,0,0,0,0,0,0,0,0,0,0,0,0,0,0,0,0,0,0,0,0,0,0,0,0,2,1,3,0,3
2023,"Causal associations of thyroid function and sudden sensorineural hearing loss: a bidirectional and multivariable Mendelian randomization study",16642295,"Frontiers in Neurology","14","",0,0,0,0,0,0,0,0,0,0,0,0,0,0,0,0,0,0,0,0,0,0,0,0,0,3,0,3,0,3
2023,"Causal relationship between rheumatoid arthritis and hypothyroidism or hyperthyroidism: a bidirectional two-sample univariable and multivariable Mendelian randomization study",16642392,"Frontiers in Endocrinology","14","",0,0,0,0,0,0,0,0,0,0,0,0,0,0,0,0,0,0,0,0,0,0,0,0,0,3,0,3,0,3
2023,"The associations between asthma and common comorbidities: a comprehensive Mendelian randomization study",2296858X,"Frontiers in Medicine","10","",0,0,0,0,0,0,0,0,0,0,0,0,0,0,0,0,0,0,0,0,0,0,0,0,0,2,1,3,0,3
2023,"Association of coffee and caffeine consumption with risk and prognosis of endometrial cancer and its subgroups: a Mendelian randomization",2296861X,"Frontiers in Nutrition","10","",0,0,0,0,0,0,0,0,0,0,0,0,0,0,0,0,0,0,0,0,0,0,0,0,0,3,0,3,0,3
2023,"Causal effects of nonalcoholic fatty liver disease on cerebral cortical structure: a Mendelian randomization analysis",16642392,"Frontiers in Endocrinology","14","",0,0,0,0,0,0,0,0,0,0,0,0,0,0,0,0,0,0,0,0,0,0,0,0,0,0,3,3,0,3
2023,"No evidence of a causal relationship between ankylosing spondylitis and cardiovascular disease: a two-sample Mendelian randomization study",2297055X,"Frontiers in Cardiovascular Medicine","10","",0,0,0,0,0,0,0,0,0,0,0,0,0,0,0,0,0,0,0,0,0,0,0,0,0,3,0,3,0,3
2023,"Causal effects of walking pace on osteoarthritis: a two-sample mendelian randomization study",16648021,"Frontiers in Genetics","14","",0,0,0,0,0,0,0,0,0,0,0,0,0,0,0,0,0,0,0,0,0,0,0,0,0,2,1,3,0,3
2023,"Correlations between schizophrenia and lichen planus: a two-sample bidirectional Mendelian randomization study",16640640,"Frontiers in Psychiatry","14","",0,0,0,0,0,0,0,0,0,0,0,0,0,0,0,0,0,0,0,0,0,0,0,0,1,1,1,3,0,3
2023,"Causal association of polyunsaturated fatty acids with chronic pain: a two-sample Mendelian randomization study",2296861X,"Frontiers in Nutrition","10","",0,0,0,0,0,0,0,0,0,0,0,0,0,0,0,0,0,0,0,0,0,0,0,0,0,2,1,3,0,3
2023,"The causal association between polycystic ovary syndrome and susceptibility and severity of COVID-19: a bidirectional Mendelian randomization study using genetic data",16642392,"Frontiers in Endocrinology","14","",0,0,0,0,0,0,0,0,0,0,0,0,0,0,0,0,0,0,0,0,0,0,0,0,0,1,2,3,0,3
2023,"Causal relationship between circulating lipid traits and periodontitis: univariable and multivariable Mendelian randomization",16642392,"Frontiers in Endocrinology","14","",0,0,0,0,0,0,0,0,0,0,0,0,0,0,0,0,0,0,0,0,0,0,0,0,1,2,0,3,0,3
2023,"Exploring the bidirectional causal link between household income status and genetic susceptibility to neurological diseases: findings from a Mendelian randomization study",22962565,"Frontiers in Public Health","11","",0,0,0,0,0,0,0,0,0,0,0,0,0,0,0,0,0,0,0,0,0,0,0,0,0,3,0,3,0,3
2023,"Mendelian randomization study of thyroid function and anti-Müllerian hormone levels",16642392,"Frontiers in Endocrinology","14","",0,0,0,0,0,0,0,0,0,0,0,0,0,0,0,0,0,0,0,0,0,0,0,0,0,2,1,3,0,3
2023,"The causal associations between growth factors and constipation: a two-sample Mendelian randomization study",1664042X,"Frontiers in Physiology","14","",0,0,0,0,0,0,0,0,0,0,0,0,0,0,0,0,0,0,0,0,0,0,0,0,0,3,0,3,0,3
2023,"Mendelian randomization study reveals the effect of idiopathic pulmonary fibrosis on the risk of erectile dysfunction",2296858X,"Frontiers in Medicine","10","",0,0,0,0,0,0,0,0,0,0,0,0,0,0,0,0,0,0,0,0,0,0,0,0,0,3,0,3,0,3
2023,"Causal association between serum total bilirubin and cholelithiasis: a bidirectional two-sample Mendelian randomization study",16642392,"Frontiers in Endocrinology","14","",0,0,0,0,0,0,0,0,0,0,0,0,0,0,0,0,0,0,0,0,0,0,0,0,0,2,1,3,0,3
2023,"A bidirectional Mendelian randomization study about the role of morning plasma cortisol in attention deficit hyperactivity disorder",16640640,"Frontiers in Psychiatry","14","",0,0,0,0,0,0,0,0,0,0,0,0,0,0,0,0,0,0,0,0,0,0,0,0,0,2,1,3,0,3
2023,"Causal associations between insulin-like growth factor 1 and vitamin D levels: a two-sample bidirectional Mendelian randomization study",2296861X,"Frontiers in Nutrition","10","",0,0,0,0,0,0,0,0,0,0,0,0,0,0,0,0,0,0,0,0,0,0,0,0,0,3,0,3,0,3
2023,"Mendelian randomization study reveals a causal relationship between coronary artery disease and cognitive impairment",2297055X,"Frontiers in Cardiovascular Medicine","10","",0,0,0,0,0,0,0,0,0,0,0,0,0,0,0,0,0,0,0,0,0,0,0,0,1,1,1,3,0,3
2023,"Inflammatory bowel disease is causally related to irritable bowel syndrome: a bidirectional two-sample Mendelian randomization study",2296858X,"Frontiers in Medicine","10","",0,0,0,0,0,0,0,0,0,0,0,0,0,0,0,0,0,0,0,0,0,0,0,0,0,3,0,3,0,3
2023,"Diseases of the musculoskeletal system and connective tissue and risk of breast cancer: Mendelian randomization study in European and East Asian populations",2234943X,"Frontiers in Oncology","13","",0,0,0,0,0,0,0,0,0,0,0,0,0,0,0,0,0,0,0,0,0,0,0,0,0,3,0,3,0,3
2023,"Causal relationships of neonatal jaundice, direct bilirubin and indirect bilirubin with autism spectrum disorder: A two-sample Mendelian randomization analysis",22962565,"Frontiers in Public Health","11","",0,0,0,0,0,0,0,0,0,0,0,0,0,0,0,0,0,0,0,0,0,0,0,0,0,2,1,3,0,3
2023,"Roles of sex hormones in mediating the causal effect of vitamin D on osteoporosis: A two-step Mendelian randomization study",16642392,"Frontiers in Endocrinology","14","",0,0,0,0,0,0,0,0,0,0,0,0,0,0,0,0,0,0,0,0,0,0,0,0,0,2,1,3,0,3
2023,"Causal relationship between type 1 diabetes mellitus and six high-frequency infectious diseases: A two-sample mendelian randomization study",16642392,"Frontiers in Endocrinology","14","",0,0,0,0,0,0,0,0,0,0,0,0,0,0,0,0,0,0,0,0,0,0,0,0,0,3,0,3,0,3
2023,"Twenty-three medication-taking traits and stroke: A comprehensive Mendelian randomization study",2297055X,"Frontiers in Cardiovascular Medicine","10","",0,0,0,0,0,0,0,0,0,0,0,0,0,0,0,0,0,0,0,0,0,0,0,0,1,2,0,3,0,3
2023,"Investigating the association between fasting insulin, erythrocytosis and HbA1c through Mendelian randomization and observational analyses",16642392,"Frontiers in Endocrinology","14","",0,0,0,0,0,0,0,0,0,0,0,0,0,0,0,0,0,0,0,0,0,0,0,0,0,3,0,3,0,3
2023,"Causal relationship between thyroid dysfunction and hallux valgus: A two-sample Mendelian randomization study",16642392,"Frontiers in Endocrinology","14","",0,0,0,0,0,0,0,0,0,0,0,0,0,0,0,0,0,0,0,0,0,0,0,0,0,3,0,3,0,3
2023,"Causal effects of physical activity on the risk of overall ovarian cancer: A Mendelian randomization study",20552076,"Digital Health","9","",0,0,0,0,0,0,0,0,0,0,0,0,0,0,0,0,0,0,0,0,0,0,0,0,0,3,0,3,0,3
2023,"Impact of genetically predicted characterization of mitochondrial DNA quantity and quality on osteoarthritis",16648021,"Frontiers in Genetics","14","",0,0,0,0,0,0,0,0,0,0,0,0,0,0,0,0,0,0,0,0,0,0,0,0,0,2,1,3,0,3
2023,"Fatty acids and risk of dilated cardiomyopathy: A two-sample Mendelian randomization study",2296861X,"Frontiers in Nutrition","10","",0,0,0,0,0,0,0,0,0,0,0,0,0,0,0,0,0,0,0,0,0,0,0,0,0,2,1,3,0,3
2022,"Causal effect of iron status on lung function: A Mendelian randomization study",2296861X,"Frontiers in Nutrition","9","",0,0,0,0,0,0,0,0,0,0,0,0,0,0,0,0,0,0,0,0,0,0,0,0,0,2,1,3,0,3
2022,"Effects of homocysteine on nonalcoholic fatty liver related disease: A mendelian randomization study",2296889X,"Frontiers in Molecular Biosciences","9","",0,0,0,0,0,0,0,0,0,0,0,0,0,0,0,0,0,0,0,0,0,0,0,0,0,2,1,3,0,3
2022,"Genetically predicted iron status was associated with the risk of prostate cancer",2234943X,"Frontiers in Oncology","12","",0,0,0,0,0,0,0,0,0,0,0,0,0,0,0,0,0,0,0,0,0,0,0,0,1,2,0,3,0,3
2022,"Causal Association of Cardiac Function by Magnetic Resonance Imaging with Frailty Index: A Mendelian Randomization Study",27305848,"Phenomics","2","6",0,0,0,0,0,0,0,0,0,0,0,0,0,0,0,0,0,0,0,0,0,0,0,0,1,1,1,3,0,3
2022,"Associations of Genetically Predicted Vitamin B12 Status across the Phenome",20726643,"Nutrients","14","23",0,0,0,0,0,0,0,0,0,0,0,0,0,0,0,0,0,0,0,0,0,0,0,0,1,2,0,3,0,3
2022,"Mendelian randomization study on the effect of tumor necrosis factor on schizophrenia",14735873,"Psychiatric Genetics","32","6",0,0,0,0,0,0,0,0,0,0,0,0,0,0,0,0,0,0,0,0,0,0,0,0,2,1,0,3,0,3
2022,"Mendelian Randomization Study on Causal Association of Pyroglutamine with COVID-19",22106014,"Journal of Epidemiology and Global Health","12","4",0,0,0,0,0,0,0,0,0,0,0,0,0,0,0,0,0,0,0,0,0,0,0,0,2,1,0,3,0,3
2022,"Diet, Lifestyle Behaviours and Other Risk Factors Associated With Type 2 Diabetes Beyond Body Mass Index: A Mendelian Randomization Study",23523840,"Canadian Journal of Diabetes","46","8",0,0,0,0,0,0,0,0,0,0,0,0,0,0,0,0,0,0,0,0,0,0,0,0,1,2,0,3,0,3
2022,"Exploring the association between birthweight and breast cancer using summary statistics from a perspective of genetic correlation, mediation, and causality",14795876,"Journal of Translational Medicine","20","1",0,0,0,0,0,0,0,0,0,0,0,0,0,0,0,0,0,0,0,0,0,0,0,0,1,2,0,3,0,3
2022,"Investigating the effects of statins on ischemic heart disease allowing for effects on body mass index: a Mendelian randomization study",20452322,"Scientific Reports","12","1",0,0,0,0,0,0,0,0,0,0,0,0,0,0,0,0,0,0,0,0,0,0,0,1,1,1,0,3,0,3
2022,"Telomere length is causally connected to brain MRI image derived phenotypes: A mendelian randomization study",19326203,"PLoS ONE","17","11 November",0,0,0,0,0,0,0,0,0,0,0,0,0,0,0,0,0,0,0,0,0,0,0,0,0,3,0,3,0,3
2022,"Thyroid Function and COVID-19 Susceptibility and Its Severity: A Two-Sample Mendelian Randomization Study",19457170,"Endocrinology (United States)","163","11",0,0,0,0,0,0,0,0,0,0,0,0,0,0,0,0,0,0,0,0,0,0,0,0,2,1,0,3,0,3
2022,"Genetic liability to sedentary behavior in relation to myocardial infarction and heart failure: A mendelian randomization study",15903729,"Nutrition, Metabolism and Cardiovascular Diseases","32","11",0,0,0,0,0,0,0,0,0,0,0,0,0,0,0,0,0,0,0,0,0,0,0,0,1,2,0,3,0,3
2022,"Linear and non-linear Mendelian randomization analyses of sex-specific associations between sleep duration and hyperuricemia",2296861X,"Frontiers in Nutrition","9","",0,0,0,0,0,0,0,0,0,0,0,0,0,0,0,0,0,0,0,0,0,0,0,0,1,1,1,3,0,3
2022,"Causal effects of systemic lupus erythematosus on endometrial cancer: A univariable and multivariable Mendelian randomization study",2234943X,"Frontiers in Oncology","12","",0,0,0,0,0,0,0,0,0,0,0,0,0,0,0,0,0,0,0,0,0,0,0,0,1,2,0,3,0,3
2022,"Association Between Atopic Dermatitis and Major Cardiovascular Outcomes: a Two-Sample Mendelian Randomization Study",21609381,"Dermatology Practical and Conceptual","12","4",0,0,0,0,0,0,0,0,0,0,0,0,0,0,0,0,0,0,0,0,0,0,0,0,0,3,0,3,0,3
2022,"Common mineral nutrients in ankylosing spondylitis: A 2-sample Mendelian randomization study",1756185X,"International Journal of Rheumatic Diseases","25","10",0,0,0,0,0,0,0,0,0,0,0,0,0,0,0,0,0,0,0,0,0,0,0,0,1,2,0,3,0,3
2022,"Systemic lupus erythematosus and the risk of cardiovascular diseases: A two-sample Mendelian randomization study",2297055X,"Frontiers in Cardiovascular Medicine","9","",0,0,0,0,0,0,0,0,0,0,0,0,0,0,0,0,0,0,0,0,0,0,0,0,1,1,1,3,0,3
2022,"Evaluating the effect of tanning response to sun exposure on the risk of skin diseases through Mendelian randomization",16648021,"Frontiers in Genetics","13","",0,0,0,0,0,0,0,0,0,0,0,0,0,0,0,0,0,0,0,0,0,0,0,0,0,3,0,3,0,3
2022,"Association between Microbiome-Related Human Genetic Variants and Fasting Plasma Glucose in a High-Cardiovascular-Risk Mediterranean Population",16489144,"Medicina (Lithuania)","58","9",0,0,0,0,0,0,0,0,0,0,0,0,0,0,0,0,0,0,0,0,0,0,0,1,0,2,0,3,0,3
2022,"Higher genetically predicted low-density lipoprotein levels increase the renal cancer risk independent of triglycerides and high-density lipoprotein levels: A Mendelian randomization study",10970215,"International Journal of Cancer","151","4",0,0,0,0,0,0,0,0,0,0,0,0,0,0,0,0,0,0,0,0,0,0,0,0,1,2,0,3,0,3
2022,"Urinary Sodium Excretion Enhances the Effect of Alcohol on Blood Pressure",22279032,"Healthcare (Switzerland)","10","7",0,0,0,0,0,0,0,0,0,0,0,0,0,0,0,0,0,0,0,0,0,0,0,0,2,0,1,3,0,3
2022,"Genetic Associations of Birthweight, Childhood, and Adult BMI on Testosterone Levels: A Mendelian Randomization",19457197,"Journal of Clinical Endocrinology and Metabolism","107","7",0,0,0,0,0,0,0,0,0,0,0,0,0,0,0,0,0,0,0,0,0,0,0,0,1,2,0,3,0,3
2022,"Roles of 21 Genera of Human Gut Microbiota in Barrett’s Esophagus Risk: A Mendelian Randomization Study",16648021,"Frontiers in Genetics","13","",0,0,0,0,0,0,0,0,0,0,0,0,0,0,0,0,0,0,0,0,0,0,0,0,1,2,0,3,0,3
2022,"Using Mendelian Randomisation to Prioritise Candidate Maternal Metabolic Traits Influencing Offspring Birthweight",22181989,"Metabolites","12","6",0,0,0,0,0,0,0,0,0,0,0,0,0,0,0,0,0,0,0,0,0,0,0,0,0,3,0,3,0,3
2022,"Genetically predicted glucosamine and longevity: A Mendelian randomization study",24054577,"Clinical Nutrition ESPEN","49","",0,0,0,0,0,0,0,0,0,0,0,0,0,0,0,0,0,0,0,0,0,0,0,0,2,1,0,3,0,3
2022,"Genetically Determined Lifestyle and Cardiometabolic Risk Factors Mediate the Association of Genetically Predicted Age at Menarche With Genetic Predisposition to Myocardial Infarction: A Two-Step, Two-Sample Mendelian Randomization Study",2297055X,"Frontiers in Cardiovascular Medicine","9","",0,0,0,0,0,0,0,0,0,0,0,0,0,0,0,0,0,0,0,0,0,0,0,1,1,1,0,3,0,3
2022,"Relationship Between Plasma Vitamin C and COVID-19 Susceptibility and Severity: A Two-Sample Mendelian Randomization Study",2296858X,"Frontiers in Medicine","9","",0,0,0,0,0,0,0,0,0,0,0,0,0,0,0,0,0,0,0,0,0,0,0,0,2,1,0,3,0,3
2022,"Investigating Causal Relations between Genetic-Related Intermediate Endophenotype and Risk of Chronic Prostatitis: Mendelian Randomization Study",19420994,"Oxidative Medicine and Cellular Longevity","2022","",0,0,0,0,0,0,0,0,0,0,0,0,0,0,0,0,0,0,0,0,0,0,0,0,1,2,0,3,0,3
2022,"Educational level as a cause of type 2 diabetes mellitus: Caution from triangulation of observational and genetic evidence",14325233,"Acta Diabetologica","59","1",0,0,0,0,0,0,0,0,0,0,0,0,0,0,0,0,0,0,0,0,0,0,0,0,0,3,0,3,0,3
2021,"Causal effect of Lipoprotein-associated phospholipase A2 activity on coronary artery disease and myocardial Infarction: A Two-Sample Mendelian Randomization study",18733492,"Clinica Chimica Acta","523","",0,0,0,0,0,0,0,0,0,0,0,0,0,0,0,0,0,0,0,0,0,0,0,0,1,2,0,3,0,3
2021,"Credible Mendelian Randomization Studies in the Presence of Selection Bias Using Control Exposures",16648021,"Frontiers in Genetics","12","",0,0,0,0,0,0,0,0,0,0,0,0,0,0,0,0,0,0,0,0,0,0,0,1,2,0,0,3,0,3
2021,"A framework to decipher the genetic architecture of combinations of complex diseases: Applications in cardiovascular medicine",13674811,"Bioinformatics","37","22",0,0,0,0,0,0,0,0,0,0,0,0,0,0,0,0,0,0,0,0,0,0,1,1,0,1,0,3,0,3
2021,"MR-PheWAS for the causal effects of serum magnesium on multiple disease outcomes in Caucasian descent",25890042,"iScience","24","10",0,0,0,0,0,0,0,0,0,0,0,0,0,0,0,0,0,0,0,0,0,0,0,2,1,0,0,3,0,3
2021,"Joint Analysis of Genome-Wide Association Data Reveals No Genetic Correlations Between Low Back Pain and Neurodegenerative Diseases",16648021,"Frontiers in Genetics","12","",0,0,0,0,0,0,0,0,0,0,0,0,0,0,0,0,0,0,0,0,0,0,0,2,1,0,0,3,0,3
2021,"Daytime sleepiness and risk of stroke: A Mendelian randomization analysis",18726968,"Clinical Neurology and Neurosurgery","208","",0,0,0,0,0,0,0,0,0,0,0,0,0,0,0,0,0,0,0,0,0,0,0,0,2,0,1,3,0,3
2021,"Sleep duration and auditory hallucinations: Genetic correlation and two-sample Mendelian randomization study",15732517,"Journal of Affective Disorders","291","",0,0,0,0,0,0,0,0,0,0,0,0,0,0,0,0,0,0,0,0,0,0,0,1,1,1,0,3,0,3
2021,"Using Genetic Variants to Evaluate the Causal Effect of Plasma Phospholipid Fatty Acids on Breast Cancer and Prostate Cancer: A Mendelian Randomization Study",16648021,"Frontiers in Genetics","12","",0,0,0,0,0,0,0,0,0,0,0,0,0,0,0,0,0,0,0,0,0,0,0,2,0,1,0,3,0,3
2021,"Investigating the causal relationship between human blood metabolites and coronary artery disease using two-sample Mendelian randomization",16734254,"Nan Fang Yi Ke Da Xue Xue Bao / Journal of Southern Medical University","41","2",0,0,0,0,0,0,0,0,0,0,0,0,0,0,0,0,0,0,0,0,0,0,0,1,0,1,1,3,0,3
2021,"Mendelian randomization as an approach to assess causal effects of inflammatory bowel disease on atrial fibrillation",19454589,"Aging","13","8",0,0,0,0,0,0,0,0,0,0,0,0,0,0,0,0,0,0,0,0,0,0,0,1,1,1,0,3,0,3
2020,"Mendelian Randomization Analysis Reveals a Causal Effect of Urinary Sodium/Urinary Creatinine Ratio on Kidney Function in Europeans",22964185,"Frontiers in Bioengineering and Biotechnology","8","",0,0,0,0,0,0,0,0,0,0,0,0,0,0,0,0,0,0,0,0,0,0,1,0,1,0,1,3,0,3
2020,"Role of DNA methylation in the association of lung function with body mass index: A two-step epigenetic Mendelian randomisation study",14712466,"BMC Pulmonary Medicine","20","1",0,0,0,0,0,0,0,0,0,0,0,0,0,0,0,0,0,0,0,0,0,0,0,2,1,0,0,3,0,3
2020,"Investigating Causality Between Blood Metabolites and Emotional and Behavioral Responses to Traumatic Stress: a Mendelian Randomization Study",15591182,"Molecular Neurobiology","57","3",0,0,0,0,0,0,0,0,0,0,0,0,0,0,0,0,0,0,0,0,0,0,2,0,1,0,0,3,0,3
2020,"Investigating Causal Relations between Risk Tolerance, Risky Behaviors, and Alzheimer's Disease: A Bidirectional Two-Sample Mendelian Randomization Study",18758908,"Journal of Alzheimer's Disease","78","4",0,0,0,0,0,0,0,0,0,0,0,0,0,0,0,0,0,0,0,0,0,0,0,1,1,1,0,3,0,3
2017,"Mendelian Randomization Analysis Identifies Body Mass Index and Fasting Insulin as Potential Causal Risk Factors for Pancreatic Cancer Risk",14602105,"Journal of the National Cancer Institute","109","9",0,0,0,0,0,0,0,0,0,0,0,0,0,0,0,0,0,0,0,1,0,0,1,1,0,0,0,3,0,3
2024,"Mendelian randomization analysis using multiple biomarkers of an underlying common exposure",14684357,"Biostatistics","25","4",0,0,0,0,0,0,0,0,0,0,0,0,0,0,0,0,0,0,0,0,0,0,0,0,0,1,1,2,0,2
2024,"Inflammatory cytokines and their potential role in kidney stone disease: a Mendelian randomization study",15732584,"International Urology and Nephrology","56","10",0,0,0,0,0,0,0,0,0,0,0,0,0,0,0,0,0,0,0,0,0,0,0,0,0,2,0,2,0,2
2024,"Phenotypic and genetic effect of carotid intima-media thickness on the risk of stroke",14321203,"Human Genetics","143","9-10",0,0,0,0,0,0,0,0,0,0,0,0,0,0,0,0,0,0,0,0,0,0,0,0,0,1,1,2,0,2
2024,"Mendelian randomization analysis using GWAS and eQTL data to investigate the relationship between chronotype and neuropsychiatric disorders and their molecular basis",1552485X,"American Journal of Medical Genetics, Part B: Neuropsychiatric Genetics","195","7",0,0,0,0,0,0,0,0,0,0,0,0,0,0,0,0,0,0,0,0,0,0,0,0,0,2,0,2,0,2
2024,"91 Circulating inflammatory proteins and the risk of age-related macular degeneration: A bidirectional Mendelian randomization study",18781705,"International Immunopharmacology","139","",0,0,0,0,0,0,0,0,0,0,0,0,0,0,0,0,0,0,0,0,0,0,0,0,0,1,1,2,0,2
2024,"Using instruments for selection to adjust for selection bias in Mendelian randomization",10970258,"Statistics in Medicine","43","22",0,0,0,0,0,0,0,0,0,0,0,0,0,0,0,0,0,0,0,0,0,0,0,0,0,0,2,2,0,2
2024,"Depression, stress-related disorders and risk for dental caries and periodontitis: A bidirectional and multivariable Mendelian randomization study",15732517,"Journal of Affective Disorders","361","",0,0,0,0,0,0,0,0,0,0,0,0,0,0,0,0,0,0,0,0,0,0,0,0,0,1,1,2,0,2
2024,"Causal influence of plasma metabolites on age-related macular degeneration: A Mendelian randomization study",15365964,"Medicine (United States)","103","37",0,0,0,0,0,0,0,0,0,0,0,0,0,0,0,0,0,0,0,0,0,0,0,0,0,2,0,2,0,2
2024,"Causal associations between COVID-19 and erectile dysfunction: a Mendelian randomization study",14732300,"Journal of International Medical Research","52","9",0,0,0,0,0,0,0,0,0,0,0,0,0,0,0,0,0,0,0,0,0,0,0,0,0,0,2,2,0,2
2024,"Association between visceral adipose tissue and asthma based on the NHANES and Mendelian randomization study",14690756,"Postgraduate Medical Journal","100","1187",0,0,0,0,0,0,0,0,0,0,0,0,0,0,0,0,0,0,0,0,0,0,0,0,0,1,1,2,0,2
2024,"Causal relationship between C-reactive protein and ischemic stroke caused by atherosclerosis: A Mendelian randomization study",15328511,"Journal of Stroke and Cerebrovascular Diseases","33","9",0,0,0,0,0,0,0,0,0,0,0,0,0,0,0,0,0,0,0,0,0,0,0,0,0,0,2,2,0,2
2024,"Genetic association of lipid traits and lipid-related drug targets with normal tension glaucoma: a Mendelian randomization study for predictive preventive and personalized medicine",18785085,"EPMA Journal","15","3",0,0,0,0,0,0,0,0,0,0,0,0,0,0,0,0,0,0,0,0,0,0,0,0,0,0,2,2,0,2
2024,"Predicting the potential deterioration of Barrett’s esophagus based on gut microbiota: a Mendelian randomization analysis",14321777,"Mammalian Genome","35","3",0,0,0,0,0,0,0,0,0,0,0,0,0,0,0,0,0,0,0,0,0,0,0,0,0,0,2,2,0,2
2024,"Potential Benefits of Statin Therapy in Reducing Osteoarthritis Risk: A Mendelian Randomization Study",21514658,"Arthritis Care and Research","76","9",0,0,0,0,0,0,0,0,0,0,0,0,0,0,0,0,0,0,0,0,0,0,0,0,0,0,2,2,0,2
2024,"Genetic Association of Lipids and Lipid-Lowering Drug Target Genes With Attention Deficit Hyperactivity Disorder",15571246,"Journal of Attention Disorders","28","11",0,0,0,0,0,0,0,0,0,0,0,0,0,0,0,0,0,0,0,0,0,0,0,0,0,2,0,2,0,2
2024,"The role of serum interleukins in Cancer: A Multi-center Mendelian Randomization study",18781705,"International Immunopharmacology","137","",0,0,0,0,0,0,0,0,0,0,0,0,0,0,0,0,0,0,0,0,0,0,0,0,0,0,2,2,0,2
2024,"Mendelian randomization study on the association between rheumatoid arthritis and osteoporosis and bone mineral density",20954344,"Chinese Journal of Tissue Engineering Research","28","23",0,0,0,0,0,0,0,0,0,0,0,0,0,0,0,0,0,0,0,0,0,0,0,0,0,2,0,2,0,2
2024,"Causal relationships between immune cells, inflammatory factors, serum metabolites, and hepatic cancer: A two-sample Mendelian randomization study",24058440,"Heliyon","10","15",0,0,0,0,0,0,0,0,0,0,0,0,0,0,0,0,0,0,0,0,0,0,0,0,0,2,0,2,0,2
2024,"No bidirectional association between serum 25-hydroxyvitamin D and erectile dysfunction: Mendelian randomization and genetic association studies",20501161,"Sexual Medicine","12","4",0,0,0,0,0,0,0,0,0,0,0,0,0,0,0,0,0,0,0,0,0,0,0,0,0,1,1,2,0,2
2024,"Causality of inflammatory bowel disease and seborrheic keratosis: A bidirectional two-sample Mendelian randomization study",16000846,"Skin Research and Technology","30","8",0,0,0,0,0,0,0,0,0,0,0,0,0,0,0,0,0,0,0,0,0,0,0,0,0,1,1,2,0,2
2024,"Antihypertensive Drugs for the Prevention of Atrial Fibrillation: A Drug Target Mendelian Randomization Study",15244563,"Hypertension","81","8",0,0,0,0,0,0,0,0,0,0,0,0,0,0,0,0,0,0,0,0,0,0,0,0,0,2,0,2,0,2
2024,"Assessing the impact of circulating inflammatory cytokines and proteins as drivers and therapeutic targets in epilepsy: A Mendelian randomization study",15255069,"Epilepsy and Behavior","157","",0,0,0,0,0,0,0,0,0,0,0,0,0,0,0,0,0,0,0,0,0,0,0,0,0,1,1,2,0,2
2024,"Genetic Connectivity of Gut Microbiota and Oral Ulcers: A Mendelian Randomization Study",1875595X,"International Dental Journal","74","4",0,0,0,0,0,0,0,0,0,0,0,0,0,0,0,0,0,0,0,0,0,0,0,0,0,0,2,2,0,2
2024,"Causality of blood metabolites and metabolic pathways on Graves’ disease and Graves’ ophthalmopathy: a two-sample Mendelian randomization study",15590100,"Endocrine","85","2",0,0,0,0,0,0,0,0,0,0,0,0,0,0,0,0,0,0,0,0,0,0,0,0,0,2,0,2,0,2
2024,"The Potential Role of Female Sex Hormones in Patients With Inflammatory Bowel Disease: A 2-Sample Mendelian Randomization Study",2155384X,"Clinical and Translational Gastroenterology","15","8",0,0,0,0,0,0,0,0,0,0,0,0,0,0,0,0,0,0,0,0,0,0,0,0,0,0,2,2,0,2
2024,"Exploring Causal Relationships Between Gut Microbiota and Alzheimer's Disease: A Bidirectional Mendelian Randomization Study",25424823,"Journal of Alzheimer's Disease Reports","8","1",0,0,0,0,0,0,0,0,0,0,0,0,0,0,0,0,0,0,0,0,0,0,0,0,0,1,1,2,0,2
2024,"The Causal Effect of 179 Plasma Lipid Groups on Immune Thrombocytopenia: A Mendelian Randomized Study",15508080,"Annals of Clinical and Laboratory Science","54","4",0,0,0,0,0,0,0,0,0,0,0,0,0,0,0,0,0,0,0,0,0,0,0,0,0,1,1,2,0,2
2024,"Assessment of causal association between the socio-economic status and osteoporosis and fractures: a bidirectional Mendelian randomization study in European population",15234681,"Journal of Bone and Mineral Research","39","7",0,0,0,0,0,0,0,0,0,0,0,0,0,0,0,0,0,0,0,0,0,0,0,0,0,1,1,2,0,2
