2023,"Dissecting shared genetic architecture between obesity and multiple sclerosis",23523964,"eBioMedicine","93","",0,0,0,0,0,0,0,0,0,0,0,0,0,0,0,0,0,0,0,0,0,0,0,0,0,12,6,18,0,18
2023,"Clarifying the effect of gut microbiota on allergic conjunctivitis risk is instrumental for predictive, preventive, and personalized medicine: a Mendelian randomization analysis",18785085,"EPMA Journal","14","2",0,0,0,0,0,0,0,0,0,0,0,0,0,0,0,0,0,0,0,0,0,0,0,0,1,14,3,18,0,18
2023,"Causal link between gut microbiota and four types of pancreatitis: a genetic association and bidirectional Mendelian randomization study",1664302X,"Frontiers in Microbiology","14","",0,0,0,0,0,0,0,0,0,0,0,0,0,0,0,0,0,0,0,0,0,0,0,0,0,12,6,18,0,18
2023,"Obesity and risk for respiratory diseases: a Mendelian randomization study",16642392,"Frontiers in Endocrinology","14","",0,0,0,0,0,0,0,0,0,0,0,0,0,0,0,0,0,0,0,0,0,0,0,0,1,8,9,18,0,18
2023,"Gut microbiota and sepsis: bidirectional Mendelian study and mediation analysis",16643224,"Frontiers in Immunology","14","",0,0,0,0,0,0,0,0,0,0,0,0,0,0,0,0,0,0,0,0,0,0,0,0,2,9,7,18,0,18
2023,"Exploring the causal effects of the gut microbiome on serum lipid levels: A two-sample Mendelian randomization analysis",1664302X,"Frontiers in Microbiology","14","",0,0,0,0,0,0,0,0,0,0,0,0,0,0,0,0,0,0,0,0,0,0,0,0,8,9,1,18,0,18
2023,"Data integration in causal inference",19390068,"Wiley Interdisciplinary Reviews: Computational Statistics","15","1",0,0,0,0,0,0,0,0,0,0,0,0,0,0,0,0,0,0,0,0,0,0,0,1,3,12,2,18,0,18
2022,"A Mendelian randomization study to assess the genetic liability of gastroesophageal reflux disease for cardiovascular diseases and risk factors",14602083,"Human Molecular Genetics","31","24",0,0,0,0,0,0,0,0,0,0,0,0,0,0,0,0,0,0,0,0,0,0,0,0,5,11,2,18,0,18
2022,"Genetically predicted telomere length and Alzheimer’s disease endophenotypes: a Mendelian randomization study",17589193,"Alzheimer's Research and Therapy","14","1",0,0,0,0,0,0,0,0,0,0,0,0,0,0,0,0,0,0,0,0,0,0,0,0,3,12,3,18,0,18
2022,"Iron status and the risk of sepsis and severe COVID-19: a two-sample Mendelian randomization study",20452322,"Scientific Reports","12","1",0,0,0,0,0,0,0,0,0,0,0,0,0,0,0,0,0,0,0,0,0,0,0,0,9,7,2,18,0,18
2022,"Robust Mendelian randomization in the presence of residual population stratification, batch effects and horizontal pleiotropy",20411723,"Nature Communications","13","1",0,0,0,0,0,0,0,0,0,0,0,0,0,0,0,0,0,0,0,0,0,0,0,1,6,8,3,18,0,18
2022,"Polygenic contribution to the relationship of loneliness and social isolation with schizophrenia",20411723,"Nature Communications","13","1",0,0,0,0,0,0,0,0,0,0,0,0,0,0,0,0,0,0,0,0,0,0,0,3,5,7,3,18,0,18
2022,"A genetic association study reveals the relationship between the oral microbiome and anxiety and depression symptoms",16640640,"Frontiers in Psychiatry","13","",0,0,0,0,0,0,0,0,0,0,0,0,0,0,0,0,0,0,0,0,0,0,0,0,1,15,2,18,0,18
2022,"Effects of general and central adiposity on circulating lipoprotein, lipid, and metabolite levels in UK Biobank: A multivariable Mendelian randomization study",26667762,"The Lancet Regional Health - Europe","21","",0,0,0,0,0,0,0,0,0,0,0,0,0,0,0,0,0,0,0,0,0,0,0,1,8,7,2,18,0,18
2022,"Causal associations between thyroid dysfunction and COVID-19 susceptibility and severity: A bidirectional Mendelian randomization study",16642392,"Frontiers in Endocrinology","13","",0,0,0,0,0,0,0,0,0,0,0,0,0,0,0,0,0,0,0,0,0,0,0,0,6,10,2,18,0,18
2022,"Does smoking protect against developing osteoarthritis? Evidence from a genetically informed perspective",1532866X,"Seminars in Arthritis and Rheumatism","55","",0,0,0,0,0,0,0,0,0,0,0,0,0,0,0,0,0,0,0,0,0,0,0,0,8,9,1,18,0,18
2022,"Causal Association Between Tea Consumption and Bone Health: A Mendelian Randomization Study",2296861X,"Frontiers in Nutrition","9","",0,0,0,0,0,0,0,0,0,0,0,0,0,0,0,0,0,0,0,0,0,0,0,1,6,9,2,18,0,18
2022,"Using genetics to assess the association of commonly used antihypertensive drugs with diabetes, glycaemic traits and lipids: a trans-ancestry Mendelian randomisation study",14320428,"Diabetologia","65","4",0,0,0,0,0,0,0,0,0,0,0,0,0,0,0,0,0,0,0,0,0,0,0,1,4,10,3,18,0,18
2022,"Dietary-Derived Essential Nutrients and Amyotrophic Lateral Sclerosis: A Two-Sample Mendelian Randomization Study",20726643,"Nutrients","14","5",0,0,0,0,0,0,0,0,0,0,0,0,0,0,0,0,0,0,0,0,0,0,0,1,5,8,4,18,0,18
2022,"Uric Acid Mediated the Association Between BMI and Postmenopausal Breast Cancer Incidence: A Bidirectional Mendelian Randomization Analysis and Prospective Cohort Study",16642392,"Frontiers in Endocrinology","12","",0,0,0,0,0,0,0,0,0,0,0,0,0,0,0,0,0,0,0,0,0,0,0,1,4,7,6,18,0,18
2022,"Do sex hormones confound or mediate the effect of chronotype on breast and prostate cancer? A Mendelian randomization study",15537404,"PLoS Genetics","18","1",0,0,0,0,0,0,0,0,0,0,0,0,0,0,0,0,0,0,0,0,0,0,0,2,7,7,2,18,0,18
2022,"Genetically predicted telomere length and its relationship with neurodegenerative diseases and life expectancy",20010370,"Computational and Structural Biotechnology Journal","20","",0,0,0,0,0,0,0,0,0,0,0,0,0,0,0,0,0,0,0,0,0,0,0,0,8,9,1,18,0,18
2022,"Causal association of gut microbiome on the risk of rheumatoid arthritis: A Mendelian randomisation study",14682060,"Annals of the Rheumatic Diseases","81","1",0,0,0,0,0,0,0,0,0,0,0,0,0,0,0,0,0,0,0,0,0,3,2,4,3,6,0,18,0,18
2021,"Age at menarche, age at natural menopause, and risk of rheumatoid arthritis — a Mendelian randomization study",14786362,"Arthritis Research and Therapy","23","1",0,0,0,0,0,0,0,0,0,0,0,0,0,0,0,0,0,0,0,0,0,0,2,3,8,4,1,18,0,18
2021,"Investigating genetic correlation and causality between nicotine dependence and ADHD in a broader psychiatric context",1552485X,"American Journal of Medical Genetics, Part B: Neuropsychiatric Genetics","186","7",0,0,0,0,0,0,0,0,0,0,0,0,0,0,0,0,0,0,0,0,0,0,0,6,5,6,1,18,0,18
2021,"Educational attainment protects against type 2 diabetes independently of cognitive performance: a Mendelian randomization study",14325233,"Acta Diabetologica","58","5",0,0,0,0,0,0,0,0,0,0,0,0,0,0,0,0,0,0,0,0,0,0,3,4,6,4,1,18,0,18
2021,"Using genetic variants to evaluate the causal effect of cholesterol lowering on head and neck cancer risk: A Mendelian randomization study",15537404,"PLoS Genetics","17","4 April 2021",0,0,0,0,0,0,0,0,0,0,0,0,0,0,0,0,0,0,0,0,0,0,2,6,4,4,2,18,0,18
2021,"Association of Sleep Duration With Atrial Fibrillation and Heart Failure: A Mendelian Randomization Analysis",16648021,"Frontiers in Genetics","12","",0,0,0,0,0,0,0,0,0,0,0,0,0,0,0,0,0,0,0,0,0,0,0,5,5,6,2,18,0,18
2021,"High Level of Uromodulin Increases the Risk of Hypertension: A Mendelian Randomization Study",2297055X,"Frontiers in Cardiovascular Medicine","8","",0,0,0,0,0,0,0,0,0,0,0,0,0,0,0,0,0,0,0,0,0,0,0,3,5,8,2,18,0,18
2021,"Irritable bowel syndrome and migraine: evidence from Mendelian randomization analysis in the UK Biobank",17474132,"Expert Review of Gastroenterology and Hepatology","15","10",0,0,0,0,0,0,0,0,0,0,0,0,0,0,0,0,0,0,0,0,0,0,1,2,5,7,3,18,0,18
2021,"Coffee consumption and risk of breast cancer: A Mendelian randomization study",19326203,"PLoS ONE","16","1 January",0,0,0,0,0,0,0,0,0,0,0,0,0,0,0,0,0,0,0,0,0,0,0,3,4,9,2,18,0,18
2020,"Association of Educational Attainment With Adiposity, Type 2 Diabetes, and Coronary Artery Diseases: A Mendelian Randomization Study",22962565,"Frontiers in Public Health","8","",0,0,0,0,0,0,0,0,0,0,0,0,0,0,0,0,0,0,0,0,0,0,7,3,4,4,0,18,0,18
2019,"Mendelian randomization study for genetically predicted polyunsaturated fatty acids levels on overall cancer risk and mortality",10559965,"Cancer Epidemiology Biomarkers and Prevention","28","6",0,0,0,0,0,0,0,0,0,0,0,0,0,0,0,0,0,0,0,0,0,1,6,6,2,3,0,18,0,18
2019,"Association between premorbid body mass index and amyotrophic lateral sclerosis: Causal inference through genetic approaches",16642295,"Frontiers in Neurology","10","MAY",0,0,0,0,0,0,0,0,0,0,0,0,0,0,0,0,0,0,0,0,0,6,6,0,3,1,2,18,0,18
2018,"Diagnostics for pleiotropy in Mendelian randomization studies: Global and individual tests for direct effects",14766256,"American Journal of Epidemiology","187","12",0,0,0,0,0,0,0,0,0,0,0,0,0,0,0,0,0,0,0,0,1,3,4,3,1,3,3,18,0,18
2024,"Mendelian Randomization Applied to Neurology: Promises and Challenges",1526632X,"Neurology","102","4",0,0,0,0,0,0,0,0,0,0,0,0,0,0,0,0,0,0,0,0,0,0,0,0,0,11,6,17,0,17
2023,"Causal relationship between sarcopenia and osteoarthritis: a bi-directional two-sample mendelian randomized study",2047783X,"European Journal of Medical Research","28","1",0,0,0,0,0,0,0,0,0,0,0,0,0,0,0,0,0,0,0,0,0,0,0,0,0,12,5,17,0,17
2023,"Genetic association of circulating C-reactive protein levels with idiopathic pulmonary fibrosis: a two-sample Mendelian randomization study",1465993X,"Respiratory Research","24","1",0,0,0,0,0,0,0,0,0,0,0,0,0,0,0,0,0,0,0,0,0,0,0,0,6,7,4,17,0,17
2023,"The Association of Physical Activity with Glaucoma and Related Traits in the UK Biobank",15494713,"Ophthalmology","130","10",0,0,0,0,0,0,0,0,0,0,0,0,0,0,0,0,0,0,0,0,0,0,0,0,2,8,7,17,0,17
2023,"Association of Longer Leukocyte Telomere Length With Cardiac Size, Function, and Heart Failure",23806591,"JAMA Cardiology","8","9",0,0,0,0,0,0,0,0,0,0,0,0,0,0,0,0,0,0,0,0,0,0,0,0,1,11,5,17,0,17
2023,"Genetic underpinning of the comorbidity between type 2 diabetes and osteoarthritis",15376605,"American Journal of Human Genetics","110","8",0,0,0,0,0,0,0,0,0,0,0,0,0,0,0,0,0,0,0,0,0,0,0,0,1,9,7,17,0,17
2023,"Testing the causal relationships of physical activity and sedentary behaviour with mental health and substance use disorders: a Mendelian randomisation study",14765578,"Molecular Psychiatry","28","8",0,0,0,0,0,0,0,0,0,0,0,0,0,0,0,0,0,0,0,0,0,0,0,0,0,12,5,17,0,17
2023,"Exploring the Effect of the Gut Microbiome on the Risk of Age-Related Macular Degeneration From the Perspective of Causality",15525783,"Investigative Ophthalmology and Visual Science","64","7",0,0,0,0,0,0,0,0,0,0,0,0,0,0,0,0,0,0,0,0,0,0,0,0,1,9,7,17,0,17
2023,"Investigating association between gut microbiota and sarcopenia-related traits: a Mendelian randomization study",25161571,"Precision Clinical Medicine","6","2",0,0,0,0,0,0,0,0,0,0,0,0,0,0,0,0,0,0,0,0,0,0,0,0,0,12,5,17,0,17
2023,"Causal effect of adiposity on the risk of 19 gastrointestinal diseases: a Mendelian randomization study",1930739X,"Obesity","31","5",0,0,0,0,0,0,0,0,0,0,0,0,0,0,0,0,0,0,0,0,0,0,0,0,2,13,2,17,0,17
2023,"Smoking, alcohol consumption, and frailty: A Mendelian randomization study",16648021,"Frontiers in Genetics","14","",0,0,0,0,0,0,0,0,0,0,0,0,0,0,0,0,0,0,0,0,0,0,0,0,1,11,5,17,0,17
2023,"Periodontitis and stroke: A Mendelian randomization study",21623279,"Brain and Behavior","13","2",0,0,0,0,0,0,0,0,0,0,0,0,0,0,0,0,0,0,0,0,0,0,0,0,2,13,2,17,0,17
2023,"Assessing the causal relationships between human blood metabolites and the risk of NAFLD: A comprehensive mendelian randomization study",16648021,"Frontiers in Genetics","14","",0,0,0,0,0,0,0,0,0,0,0,0,0,0,0,0,0,0,0,0,0,0,0,0,1,10,6,17,0,17
2023,"Constipation and cardiovascular disease: A two-sample Mendelian randomization analysis",2297055X,"Frontiers in Cardiovascular Medicine","10","",0,0,0,0,0,0,0,0,0,0,0,0,0,0,0,0,0,0,0,0,0,0,0,0,3,10,4,17,0,17
2023,"Human blood metabolites and lacunar stroke: A Mendelian randomization study",17474949,"International Journal of Stroke","18","1",0,0,0,0,0,0,0,0,0,0,0,0,0,0,0,0,0,0,0,0,0,0,0,0,4,10,3,17,0,17
2022,"Causal effects of fatty acids on depression: Mendelian randomization study",2296861X,"Frontiers in Nutrition","9","",0,0,0,0,0,0,0,0,0,0,0,0,0,0,0,0,0,0,0,0,0,0,0,0,5,11,1,17,0,17
2022,"Identifying and ranking causal biochemical biomarkers for breast cancer: a Mendelian randomisation study",17417015,"BMC Medicine","20","1",0,0,0,0,0,0,0,0,0,0,0,0,0,0,0,0,0,0,0,0,0,0,0,0,5,12,0,17,0,17
2022,"Investigating causal relations between sleep duration and risks of adverse pregnancy and perinatal outcomes: linear and nonlinear Mendelian randomization analyses",17417015,"BMC Medicine","20","1",0,0,0,0,0,0,0,0,0,0,0,0,0,0,0,0,0,0,0,0,0,0,0,0,2,11,4,17,0,17
2022,"GWAS-associated bacteria and their metabolites appear to be causally related to the development of inflammatory bowel disease",14765640,"European Journal of Clinical Nutrition","76","7",0,0,0,0,0,0,0,0,0,0,0,0,0,0,0,0,0,0,0,0,0,0,0,2,5,9,1,17,0,17
2022,"Type 2 diabetes mellitus increases risk of erectile dysfunction independent of obesity and dyslipidemia: A Mendelian randomization study",20472927,"Andrology","10","3",0,0,0,0,0,0,0,0,0,0,0,0,0,0,0,0,0,0,0,0,0,0,0,5,4,7,1,17,0,17
2022,"Blood Leukocyte Counts in Alzheimer Disease",25743805,"JAMA Network Open","","",0,0,0,0,0,0,0,0,0,0,0,0,0,0,0,0,0,0,0,0,0,0,0,0,1,13,3,17,0,17
2022,"Circulating C-reactive protein increases lung cancer risk: Results from a prospective cohort of UK Biobank",10970215,"International Journal of Cancer","150","1",0,0,0,0,0,0,0,0,0,0,0,0,0,0,0,0,0,0,0,0,0,0,1,4,5,5,2,17,0,17
2021,"A selection pressure landscape for 870 human polygenic traits",23973374,"Nature Human Behaviour","5","12",0,0,0,0,0,0,0,0,0,0,0,0,0,0,0,0,0,0,0,0,0,0,1,5,6,4,1,17,0,17
2021,"Using Mendelian randomization study to assess the renal effects of antihypertensive drugs",17417015,"BMC Medicine","19","1",0,0,0,0,0,0,0,0,0,0,0,0,0,0,0,0,0,0,0,0,0,0,1,3,3,9,1,17,0,17
2021,"Unlocking the causal link of metabolically different adiposity subtypes with brain volumes and the risks of dementia and stroke: A Mendelian randomization study",15581497,"Neurobiology of Aging","102","",0,0,0,0,0,0,0,0,0,0,0,0,0,0,0,0,0,0,0,0,0,0,0,6,8,3,0,17,0,17
2021,"Fasting glucose, bone area and bone mineral density: a Mendelian randomisation study",14320428,"Diabetologia","64","6",0,0,0,0,0,0,0,0,0,0,0,0,0,0,0,0,0,0,0,0,0,0,2,3,6,5,1,17,0,17
2021,"Causal effects of relative fat, protein, and carbohydrate intake on chronic kidney disease: A Mendelian randomization study",19383207,"American Journal of Clinical Nutrition","113","4",0,0,0,0,0,0,0,0,0,0,0,0,0,0,0,0,0,0,0,0,0,0,1,6,1,7,2,17,0,17
2021,"Causal associations between serum urea and cancer: A mendelian randomization study",20734425,"Genes","12","4",0,0,0,0,0,0,0,0,0,0,0,0,0,0,0,0,0,0,0,0,0,0,0,3,5,9,0,17,0,17
2021,"Tuberculosis Exposure with Risk of Behçet Disease among Patients with Uveitis",21686173,"JAMA Ophthalmology","139","4",0,0,0,0,0,0,0,0,0,0,0,0,0,0,0,0,0,0,0,0,0,0,0,3,6,6,2,17,0,17
2021,"Exploring the Causality Between Hypothyroidism and Non-alcoholic Fatty Liver: A Mendelian Randomization Study",2296634X,"Frontiers in Cell and Developmental Biology","9","",0,0,0,0,0,0,0,0,0,0,0,0,0,0,0,0,0,0,0,0,0,0,3,1,7,4,2,17,0,17
2021,"Type 2 Diabetes, Metabolic Traits, and Risk of Heart Failure: A Mendelian Randomization Study",19355548,"Diabetes Care","44","7",0,0,0,0,0,0,0,0,0,0,0,0,0,0,0,0,0,0,0,0,0,0,0,3,8,5,1,17,0,17
2021,"Causal relationships between social isolation and osteoarthritis: A mendelian randomization study in european population",11787074,"International Journal of General Medicine","14","",0,0,0,0,0,0,0,0,0,0,0,0,0,0,0,0,0,0,0,0,0,0,0,2,3,10,2,17,0,17
2021,"The role of age at menarche and age at menopause in Alzheimer's disease: evidence from a bidirectional mendelian randomization study",19454589,"Aging","13","15",0,0,0,0,0,0,0,0,0,0,0,0,0,0,0,0,0,0,0,0,0,0,0,2,7,6,2,17,0,17
2020,"Genetic predisposition to longer telomere length and risk of childhood, adolescent and adult-onset ependymoma",20515960,"Acta Neuropathologica Communications","8","1",0,0,0,0,0,0,0,0,0,0,0,0,0,0,0,0,0,0,0,0,0,0,5,8,2,2,0,17,0,17
2020,"Morning diurnal preference and food intake: A Mendelian randomization study",19383207,"American Journal of Clinical Nutrition","112","5",0,0,0,0,0,0,0,0,0,0,0,0,0,0,0,0,0,0,0,0,0,0,3,3,4,6,1,17,0,17
2020,"Alcohol consumption and risk of breast and ovarian cancer: A Mendelian randomization study",22107770,"Cancer Genetics","245","",0,0,0,0,0,0,0,0,0,0,0,0,0,0,0,0,0,0,0,0,0,1,6,7,0,2,1,17,0,17
2020,"Genetically, Dietary Sodium Intake Is Causally Associated with Salt-Sensitive Hypertension Risk in a Community-Based Cohort Study: a Mendelian Randomization Approach",15343111,"Current Hypertension Reports","22","7",0,0,0,0,0,0,0,0,0,0,0,0,0,0,0,0,0,0,0,0,0,0,0,5,8,3,1,17,0,17
2020,"Statin-induced LDL cholesterol response and type 2 diabetes: a bidirectional two-sample Mendelian randomization study",14731150,"Pharmacogenomics Journal","20","3",0,0,0,0,0,0,0,0,0,0,0,0,0,0,0,0,0,0,0,0,0,3,1,5,5,1,2,17,0,17
2020,"The causal relationships of device-measured physical activity with bipolar disorder and schizophrenia in adults: A 2-Sample mendelian randomization study",15732517,"Journal of Affective Disorders","263","",0,0,0,0,0,0,0,0,0,0,0,0,0,0,0,0,0,0,0,0,0,2,2,4,4,3,2,17,0,17
2020,"Genetic determinants of telomere length and cancer risk",18790380,"Current Opinion in Genetics and Development","60","",0,0,0,0,0,0,0,0,0,0,0,0,0,0,0,0,0,0,0,0,0,1,4,3,5,2,2,17,0,17
2020,"Are blood lipids risk factors for fracture? Integrative evidence from instrumental variable causal inference and mediation analysis using genetic data",87563282,"Bone","131","",0,0,0,0,0,0,0,0,0,0,0,0,0,0,0,0,0,0,0,0,0,1,2,1,5,6,2,17,0,17
2020,"Assessment causality in associations between serum uric acid and risk of schizophrenia: A two-sample bidirectional mendelian randomization study",11791349,"Clinical Epidemiology","12","",0,0,0,0,0,0,0,0,0,0,0,0,0,0,0,0,0,0,0,0,0,1,2,6,5,2,1,17,0,17
2020,"Circulating glutamine and alzheimer’s disease: A mendelian randomization study",11781998,"Clinical Interventions in Aging","15","",0,0,0,0,0,0,0,0,0,0,0,0,0,0,0,0,0,0,0,0,0,0,2,6,3,5,1,17,0,17
2019,"The association between weight at birth and breast cancer risk revisited using Mendelian randomisation",15737284,"European Journal of Epidemiology","34","6",0,0,0,0,0,0,0,0,0,0,0,0,0,0,0,0,0,0,0,0,1,6,3,3,1,3,0,17,0,17
2019,"Schizophrenia risk and reproductive success: A Mendelian randomization study",20545703,"Royal Society Open Science","6","3",0,0,0,0,0,0,0,0,0,0,0,0,0,0,0,0,0,0,0,0,2,0,2,2,6,2,3,17,0,17
2018,"Mendelian randomisation study of age at menarche and age at menopause and the risk of colorectal cancer",15321827,"British Journal of Cancer","118","12",0,0,0,0,0,0,0,0,0,0,0,0,0,0,0,0,0,0,0,0,3,1,1,6,4,2,0,17,0,17
2023,"The genetic relationships between brain structure and schizophrenia",20411723,"Nature Communications","14","1",0,0,0,0,0,0,0,0,0,0,0,0,0,0,0,0,0,0,0,0,0,0,0,0,0,8,8,16,0,16
2023,"An atlas of associations between 14 micronutrients and 22 cancer outcomes: Mendelian randomization analyses",17417015,"BMC Medicine","21","1",0,0,0,0,0,0,0,0,0,0,0,0,0,0,0,0,0,0,0,0,0,0,0,0,1,14,1,16,0,16
2023,"Causal effects of modifiable risk factors on kidney stones: a bidirectional mendelian randomization study",17558794,"BMC Medical Genomics","16","1",0,0,0,0,0,0,0,0,0,0,0,0,0,0,0,0,0,0,0,0,0,0,0,0,3,9,4,16,0,16
2023,"Separating the effects of early and later life adiposity on colorectal cancer risk: a Mendelian randomization study",17417015,"BMC Medicine","21","1",0,0,0,0,0,0,0,0,0,0,0,0,0,0,0,0,0,0,0,0,0,0,0,0,2,9,5,16,0,16
2023,"Genome-wide association study of placental weight identifies distinct and shared genetic influences between placental and fetal growth",15461718,"Nature Genetics","55","11",0,0,0,0,0,0,0,0,0,0,0,0,0,0,0,0,0,0,0,0,0,0,0,0,0,10,6,16,0,16
2023,"Causal relationship between gastro-esophageal reflux disease and risk of lung cancer: insights from multivariable Mendelian randomization and mediation analysis",14643685,"International Journal of Epidemiology","52","5",0,0,0,0,0,0,0,0,0,0,0,0,0,0,0,0,0,0,0,0,0,0,0,0,1,11,4,16,0,16
2023,"Association between sleep traits and primary liver cancer: A Mendelian randomization analysis",13652362,"European Journal of Clinical Investigation","53","8",0,0,0,0,0,0,0,0,0,0,0,0,0,0,0,0,0,0,0,0,0,0,0,0,0,13,3,16,0,16
2023,"Genetic architecture of brain age and its causal relations with brain and mental disorders",14765578,"Molecular Psychiatry","28","7",0,0,0,0,0,0,0,0,0,0,0,0,0,0,0,0,0,0,0,0,0,0,0,0,0,10,6,16,0,16
2023,"Lipids and amyotrophic lateral sclerosis: A two-sample Mendelian randomization study",14681331,"European Journal of Neurology","30","7",0,0,0,0,0,0,0,0,0,0,0,0,0,0,0,0,0,0,0,0,0,0,0,0,2,9,5,16,0,16
2023,"Population-based discovery and Mendelian randomization analysis identify telmisartan as a candidate medicine for Alzheimer's disease in African Americans",15525279,"Alzheimer's and Dementia","19","5",0,0,0,0,0,0,0,0,0,0,0,0,0,0,0,0,0,0,0,0,0,0,0,0,7,7,2,16,0,16
2023,"Mendelian randomization analysis for attention deficit/hyperactivity disorder: studying a broad range of exposures and outcomes",14643685,"International Journal of Epidemiology","52","2",0,0,0,0,0,0,0,0,0,0,0,0,0,0,0,0,0,0,0,0,0,0,0,1,6,8,1,16,0,16
2023,"Genetically Predicted Sleep Traits and Functional Outcome after Ischemic Stroke: A Mendelian Randomization Study",1526632X,"Neurology","100","11",0,0,0,0,0,0,0,0,0,0,0,0,0,0,0,0,0,0,0,0,0,0,0,0,1,11,4,16,0,16
2023,"Association between Dietary Habits and Pancreatitis among Individuals of European Ancestry: A Two-Sample Mendelian Randomization Study",20726643,"Nutrients","15","5",0,0,0,0,0,0,0,0,0,0,0,0,0,0,0,0,0,0,0,0,0,0,0,0,1,12,3,16,0,16
2023,"Plasma phospholipid arachidonic acid in relation to non-alcoholic fatty liver disease: Mendelian randomization study",18731244,"Nutrition","106","",0,0,0,0,0,0,0,0,0,0,0,0,0,0,0,0,0,0,0,0,0,0,0,0,4,10,2,16,0,16
2023,"Association between sarcopenia-related traits and cardiovascular diseases: a bi-directional Mendelian randomization study",16642392,"Frontiers in Endocrinology","14","",0,0,0,0,0,0,0,0,0,0,0,0,0,0,0,0,0,0,0,0,0,0,0,0,1,10,5,16,0,16
2023,"Associations between smoke exposure and kidney stones: results from the NHANES (2007–2018) and Mendelian randomization analysis",2296858X,"Frontiers in Medicine","10","",0,0,0,0,0,0,0,0,0,0,0,0,0,0,0,0,0,0,0,0,0,0,0,0,1,11,4,16,0,16
2023,"A framework for assessing selection and misclassification bias in mendelian randomisation studies: an illustrative example between body mass index and covid-19",17561833,"BMJ","","",0,0,0,0,0,0,0,0,0,0,0,0,0,0,0,0,0,0,0,0,0,0,0,0,0,12,4,16,0,16
2023,"Circulating levels of cytokines and risk of cardiovascular disease: a Mendelian randomization study",16643224,"Frontiers in Immunology","14","",0,0,0,0,0,0,0,0,0,0,0,0,0,0,0,0,0,0,0,0,0,0,0,0,0,9,7,16,0,16
2023,"Causal relationship between ischemic stroke and its subtypes and frozen shoulder: a two-sample Mendelian randomization analysis",16642295,"Frontiers in Neurology","14","",0,0,0,0,0,0,0,0,0,0,0,0,0,0,0,0,0,0,0,0,0,0,0,0,0,14,2,16,0,16
2023,"Causal associations between obstructive sleep apnea and COVID-19: A bidirectional Mendelian randomization study",18785506,"Sleep Medicine","101","",0,0,0,0,0,0,0,0,0,0,0,0,0,0,0,0,0,0,0,0,0,0,0,0,1,12,3,16,0,16
2023,"Education plays a crucial role in the pathway from poverty to smoking: a Mendelian randomization study",13600443,"Addiction","118","1",0,0,0,0,0,0,0,0,0,0,0,0,0,0,0,0,0,0,0,0,0,0,0,1,2,12,1,16,0,16
2022,"Iron Status and NAFLD among European Populations: A Bidirectional Two-Sample Mendelian Randomization Study",20726643,"Nutrients","14","24",0,0,0,0,0,0,0,0,0,0,0,0,0,0,0,0,0,0,0,0,0,0,0,0,1,10,5,16,0,16
2022,"Obesity, Fat Distribution and Risk of Cancer in Women and Men: A Mendelian Randomisation Study",20726643,"Nutrients","14","24",0,0,0,0,0,0,0,0,0,0,0,0,0,0,0,0,0,0,0,0,0,0,0,0,2,12,2,16,0,16
2022,"Association between gut microbiota and longevity: a genetic correlation and mendelian randomization study",14712180,"BMC Microbiology","22","1",0,0,0,0,0,0,0,0,0,0,0,0,0,0,0,0,0,0,0,0,0,0,0,0,1,11,4,16,0,16
2022,"Insights into Modifiable Risk Factors of Infertility: A Mendelian Randomization Study",20726643,"Nutrients","14","19",0,0,0,0,0,0,0,0,0,0,0,0,0,0,0,0,0,0,0,0,0,0,0,0,5,6,5,16,0,16
2022,"Sex differences in the association of fasting glucose with HbA1c, and their consequences for mortality: A Mendelian randomization study",23523964,"eBioMedicine","84","",0,0,0,0,0,0,0,0,0,0,0,0,0,0,0,0,0,0,0,0,0,0,0,0,4,8,4,16,0,16
2022,"Mendelian randomization supports the causal role of fasting glucose on periodontitis",16642392,"Frontiers in Endocrinology","13","",0,0,0,0,0,0,0,0,0,0,0,0,0,0,0,0,0,0,0,0,0,0,0,1,3,10,2,16,0,16
2022,"Causality of abdominal obesity on cognition: a trans-ethnic Mendelian randomization study",14765497,"International Journal of Obesity","46","8",0,0,0,0,0,0,0,0,0,0,0,0,0,0,0,0,0,0,0,0,0,0,0,1,8,6,1,16,0,16
2022,"Evidence of a Causal Relationship Between Vitamin D Status and Risk of Psoriasis From the UK Biobank Study",2296861X,"Frontiers in Nutrition","9","",0,0,0,0,0,0,0,0,0,0,0,0,0,0,0,0,0,0,0,0,0,0,0,1,5,6,4,16,0,16
2022,"Causal effects of genetically determined metabolites on cancers included lung, breast, ovarian cancer, and glioma: a Mendelian randomization study",22264477,"Translational Lung Cancer Research","11","7",0,0,0,0,0,0,0,0,0,0,0,0,0,0,0,0,0,0,0,0,0,0,0,0,4,9,3,16,0,16
2022,"Adjusting for collider bias in genetic association studies using instrumental variable methods",10982272,"Genetic Epidemiology","46","5-6",0,0,0,0,0,0,0,0,0,0,0,0,0,0,0,0,0,0,0,0,0,0,0,1,3,9,3,16,0,16
2022,"Causal Associations of Thyroid Function and Age-Related Macular Degeneration: A Two-Sample Mendelian Randomization Study",18791891,"American Journal of Ophthalmology","239","",0,0,0,0,0,0,0,0,0,0,0,0,0,0,0,0,0,0,0,0,0,0,0,1,3,9,3,16,0,16
2022,"A lifecourse mendelian randomization study highlights the long-term influence of childhood body size on later life heart structure",15457885,"PLoS Biology","20","6",0,0,0,0,0,0,0,0,0,0,0,0,0,0,0,0,0,0,0,0,0,0,0,1,3,8,4,16,0,16
2022,"Disentangling the association between kidney function and atrial fibrillation: a bidirectional Mendelian randomization study",18741754,"International Journal of Cardiology","355","",0,0,0,0,0,0,0,0,0,0,0,0,0,0,0,0,0,0,0,0,0,0,0,0,6,10,0,16,0,16
