2022,"Assessing the causality between thyroid and breast neoplasms: A bidirectional Mendelian randomization study",2234943X,"Frontiers in Oncology","12","",0,0,0,0,0,0,0,0,0,0,0,0,0,0,0,0,0,0,0,0,0,0,0,0,2,4,1,7,0,7
2022,"Whole genome DNA and RNA sequencing of whole blood elucidates the genetic architecture of gene expression underlying a wide range of diseases",20452322,"Scientific Reports","12","1",0,0,0,0,0,0,0,0,0,0,0,0,0,0,0,0,0,0,0,0,0,0,0,0,1,4,2,7,0,7
2022,"Exploring the causal effects of genetic liability to ADHD and Autism on Alzheimer’s disease",21583188,"Translational Psychiatry","12","1",0,0,0,0,0,0,0,0,0,0,0,0,0,0,0,0,0,0,0,0,0,0,0,0,1,5,1,7,0,7
2022,"Causal relationship between type 1 diabetes and hypothyroidism: A Mendelian randomization study",13652265,"Clinical Endocrinology","97","6",0,0,0,0,0,0,0,0,0,0,0,0,0,0,0,0,0,0,0,0,0,0,0,1,2,3,1,7,0,7
2022,"Absence of causal association between Vitamin D and bone mineral density across the lifespan: a Mendelian randomization study",20452322,"Scientific Reports","12","1",0,0,0,0,0,0,0,0,0,0,0,0,0,0,0,0,0,0,0,0,0,0,0,0,5,2,0,7,0,7
2022,"Elucidating mechanisms of genetic cross-disease associations at the PROCR vascular disease locus",20411723,"Nature Communications","13","1",0,0,0,0,0,0,0,0,0,0,0,0,0,0,0,0,0,0,0,0,0,0,0,0,1,5,1,7,0,7
2022,"Type 2 diabetes mellitus and the risk of abnormal spermatozoa: A Mendelian randomization study",16642392,"Frontiers in Endocrinology","13","",0,0,0,0,0,0,0,0,0,0,0,0,0,0,0,0,0,0,0,0,0,0,0,0,0,7,0,7,0,7
2022,"The association between circulating docosahexaenoic acid and lung cancer: A Mendelian randomization study",15321983,"Clinical Nutrition","41","11",0,0,0,0,0,0,0,0,0,0,0,0,0,0,0,0,0,0,0,0,0,0,0,0,2,3,2,7,0,7
2022,"Genetic susceptibility to COVID-19 may increase the risk of erectile dysfunction: A two-sample Mendelian randomization study",14390272,"Andrologia","54","10",0,0,0,0,0,0,0,0,0,0,0,0,0,0,0,0,0,0,0,0,0,0,0,0,3,3,1,7,0,7
2022,"Circulating Isovalerylcarnitine and Lung Cancer Risk: Evidence from Mendelian Randomization and Prediagnostic Blood Measurements",15387755,"Cancer Epidemiology Biomarkers and Prevention","31","10",0,0,0,0,0,0,0,0,0,0,0,0,0,0,0,0,0,0,0,0,0,0,0,0,1,3,3,7,0,7
2022,"Causal association of diet-derived circulating antioxidants with the risk of rheumatoid arthritis: A Mendelian randomization study",1532866X,"Seminars in Arthritis and Rheumatism","56","",0,0,0,0,0,0,0,0,0,0,0,0,0,0,0,0,0,0,0,0,0,0,0,0,2,4,1,7,0,7
2022,"An integrated genome and phenome-wide association study approach to understanding Alzheimer's disease predisposition",15581497,"Neurobiology of Aging","118","",0,0,0,0,0,0,0,0,0,0,0,0,0,0,0,0,0,0,0,0,0,0,0,0,2,2,3,7,0,7
2022,"Disentangling the effects of traits with shared clustered genetic predictors using multivariable Mendelian randomization",10982272,"Genetic Epidemiology","46","7",0,0,0,0,0,0,0,0,0,0,0,0,0,0,0,0,0,0,0,0,0,0,0,0,3,2,2,7,0,7
2022,"Causal relationship between bipolar disorder and inflammatory bowel disease: A bidirectional two-sample mendelian randomization study",16648021,"Frontiers in Genetics","13","",0,0,0,0,0,0,0,0,0,0,0,0,0,0,0,0,0,0,0,0,0,0,0,0,2,4,1,7,0,7
2022,"Genetic effects of iron levels on liver injury and risk of liver diseases: A two-sample Mendelian randomization analysis",2296861X,"Frontiers in Nutrition","9","",0,0,0,0,0,0,0,0,0,0,0,0,0,0,0,0,0,0,0,0,0,0,0,1,1,4,1,7,0,7
2022,"Circulating vascular endothelial growth factor and cancer risk: A bidirectional mendelian randomization",16648021,"Frontiers in Genetics","13","",0,0,0,0,0,0,0,0,0,0,0,0,0,0,0,0,0,0,0,0,0,0,0,0,3,4,0,7,0,7
2022,"Serum bilirubin and kidney function: A Mendelian randomization study",20488513,"Clinical Kidney Journal","15","9",0,0,0,0,0,0,0,0,0,0,0,0,0,0,0,0,0,0,0,0,0,0,0,0,2,4,1,7,0,7
2022,"Educational attainment and offspring birth weight: A bidirectional Mendelian randomization study",16648021,"Frontiers in Genetics","13","",0,0,0,0,0,0,0,0,0,0,0,0,0,0,0,0,0,0,0,0,0,0,0,0,1,5,1,7,0,7
2022,"Adiposity may confound the association between vitamin D and disease risk – a lifecourse Mendelian randomization study",2050084X,"eLife","11","",0,0,0,0,0,0,0,0,0,0,0,0,0,0,0,0,0,0,0,0,0,0,0,0,1,5,1,7,0,7
2022,"Causal relationships between sex hormone traits, lifestyle factors, and osteoporosis in men: A Mendelian randomization study",19326203,"PLoS ONE","17","8 August",0,0,0,0,0,0,0,0,0,0,0,0,0,0,0,0,0,0,0,0,0,0,0,0,2,3,2,7,0,7
2022,"Estimating the causal effect of liability to disease on healthcare costs using Mendelian Randomization",18736130,"Economics and Human Biology","46","",0,0,0,0,0,0,0,0,0,0,0,0,0,0,0,0,0,0,0,0,0,0,0,1,1,5,0,7,0,7
2022,"Urticaria and increased risk of rheumatoid arthritis: a two-sample Mendelian randomisation study in European population",14397609,"Modern Rheumatology","32","4",0,0,0,0,0,0,0,0,0,0,0,0,0,0,0,0,0,0,0,0,0,0,0,1,3,2,1,7,0,7
2022,"Higher Genetically Predicted Triglycerides, LDL, and HDL Increase the Vitamin D Deficiency: A Mendelian Randomization Study",2296861X,"Frontiers in Nutrition","9","",0,0,0,0,0,0,0,0,0,0,0,0,0,0,0,0,0,0,0,0,0,0,0,0,1,5,1,7,0,7
2022,"Sex-specific effect of serum urate levels on coronary heart disease and myocardial infarction prevention: A Mendelian randomization study",15903729,"Nutrition, Metabolism and Cardiovascular Diseases","32","5",0,0,0,0,0,0,0,0,0,0,0,0,0,0,0,0,0,0,0,0,0,0,0,1,4,2,0,7,0,7
2022,"Comorbidities in osteoarthritis (ComOA): a combined cross-sectional, case-control and cohort study using large electronic health records in four European countries",20446055,"BMJ Open","12","4",0,0,0,0,0,0,0,0,0,0,0,0,0,0,0,0,0,0,0,0,0,0,0,0,4,2,1,7,0,7
2022,"Evaluating the Causal Effects of TIMP-3 on Ischaemic Stroke and Intracerebral Haemorrhage: A Mendelian Randomization Study",16648021,"Frontiers in Genetics","13","",0,0,0,0,0,0,0,0,0,0,0,0,0,0,0,0,0,0,0,0,0,0,0,0,1,4,2,7,0,7
2022,"Genetically Predicted Circulating Omega-3 Fatty Acids Levels Are Causally Associated With Increased Risk for Systemic Lupus Erythematosus",2296861X,"Frontiers in Nutrition","9","",0,0,0,0,0,0,0,0,0,0,0,0,0,0,0,0,0,0,0,0,0,0,0,1,2,3,1,7,0,7
2022,"Assessment of the relationships between genetic determinants of thyroid functions and bipolar disorder: A mendelian randomization study",15732517,"Journal of Affective Disorders","298","",0,0,0,0,0,0,0,0,0,0,0,0,0,0,0,0,0,0,0,0,0,0,0,1,1,3,2,7,0,7
2022,"Pediatric and adult obesity concerns in female health: a Mendelian randomization study",15590100,"Endocrine","75","2",0,0,0,0,0,0,0,0,0,0,0,0,0,0,0,0,0,0,0,0,0,0,0,0,4,3,0,7,0,7
2022,"Unbiased metabolome screen leads to personalized medicine strategy for amyotrophic lateral sclerosis",26321297,"Brain Communications","4","2",0,0,0,0,0,0,0,0,0,0,0,0,0,0,0,0,0,0,0,0,0,0,0,2,2,3,0,7,0,7
2022,"Association of Atopic Dermatitis with Depression and Suicide: A Two-Sample Mendelian Randomization Study",23146141,"BioMed Research International","2022","",0,0,0,0,0,0,0,0,0,0,0,0,0,0,0,0,0,0,0,0,0,0,0,2,1,3,1,7,0,7
2022,"Genetically Determined Serum 25-Hydroxyvitamin D Is Associated with Total, Trunk, and Arm Fat-Free Mass: A Mendelian Randomization Study",17604788,"Journal of Nutrition, Health and Aging","26","1",0,0,0,0,0,0,0,0,0,0,0,0,0,0,0,0,0,0,0,0,0,0,0,1,5,1,0,7,0,7
2021,"Deciphering the Irregular Risk of Stroke Increased by Obesity Classes: A Stratified Mendelian Randomization Study",16642392,"Frontiers in Endocrinology","12","",0,0,0,0,0,0,0,0,0,0,0,0,0,0,0,0,0,0,0,0,0,0,0,0,4,0,3,7,0,7
2021,"Leukocyte telomere length and amyotrophic lateral sclerosis: a Mendelian randomization study",17501172,"Orphanet Journal of Rare Diseases","16","1",0,0,0,0,0,0,0,0,0,0,0,0,0,0,0,0,0,0,0,0,0,0,0,1,4,2,0,7,0,7
2021,"The Genetic Association of Polycystic Ovary Syndrome and the Risk of Endometrial Cancer: A Mendelian Randomization Study",16642392,"Frontiers in Endocrinology","12","",0,0,0,0,0,0,0,0,0,0,0,0,0,0,0,0,0,0,0,0,0,0,0,0,2,5,0,7,0,7
2021,"Mendelian randomization under the omnigenic architecture",14774054,"Briefings in Bioinformatics","22","6",0,0,0,0,0,0,0,0,0,0,0,0,0,0,0,0,0,0,0,0,0,0,0,1,0,6,0,7,0,7
2021,"Daytime sleepiness might increase the risk of ALS: a 2-sample Mendelian randomization study",14321459,"Journal of Neurology","268","11",0,0,0,0,0,0,0,0,0,0,0,0,0,0,0,0,0,0,0,0,0,0,0,3,1,2,1,7,0,7
2021,"Evaluation relationships between subjective wellbeing, personality traits, and Alzheimer's disease: A two-sample Mendelian randomization study",18791379,"Journal of Psychiatric Research","137","",0,0,0,0,0,0,0,0,0,0,0,0,0,0,0,0,0,0,0,0,0,0,0,2,1,1,3,7,0,7
2021,"The causal effect of interleukin-17 on the risk of psoriatic arthritis: A Mendelian randomization study",14620332,"Rheumatology (United Kingdom)","60","4",0,0,0,0,0,0,0,0,0,0,0,0,0,0,0,0,0,0,0,0,0,0,0,1,3,1,2,7,0,7
2021,"Systematic identification of risk factors and drug repurposing options for Alzheimer's disease",23528737,"Alzheimer's and Dementia: Translational Research and Clinical Interventions","7","1",0,0,0,0,0,0,0,0,0,0,0,0,0,0,0,0,0,0,0,0,0,0,1,0,4,2,0,7,0,7
2021,"Examining the causal association between 25-hydroxyvitamin D and caries in children and adults: A two-sample Mendelian randomization approach",2398502X,"Wellcome Open Research","5","",0,0,0,0,0,0,0,0,0,0,0,0,0,0,0,0,0,0,0,0,0,0,0,1,3,2,1,7,0,7
2021,"Causal effect of adiposity measures on blood pressure traits in 2 urban swedish cohorts: A mendelian randomization study",20479980,"Journal of the American Heart Association","10","13",0,0,0,0,0,0,0,0,0,0,0,0,0,0,0,0,0,0,0,0,0,0,2,0,1,2,2,7,0,7
2021,"No Evidence for a Causal Relationship between Cancers and Parkinson's Disease",1877718X,"Journal of Parkinson's Disease","11","2",0,0,0,0,0,0,0,0,0,0,0,0,0,0,0,0,0,0,0,0,0,0,0,1,2,3,1,7,0,7
2020,"Does Maternal Normal Range Thyroid Function Play a Role in Offspring Birth Weight? Evidence From a Mendelian Randomization Analysis",16642392,"Frontiers in Endocrinology","11","",0,0,0,0,0,0,0,0,0,0,0,0,0,0,0,0,0,0,0,0,0,0,0,4,0,2,1,7,0,7
2020,"Detecting potential causal relationship between multiple risk factors and Alzheimer's disease using multivariable Mendelian randomization",19454589,"Aging","12","21",0,0,0,0,0,0,0,0,0,0,0,0,0,0,0,0,0,0,0,0,0,0,3,1,1,2,0,7,0,7
2020,"Causal associations of body mass index and waist-to-hip ratio with cardiometabolic traits among Chinese children: A Mendelian randomization study",15903729,"Nutrition, Metabolism and Cardiovascular Diseases","30","9",0,0,0,0,0,0,0,0,0,0,0,0,0,0,0,0,0,0,0,0,0,0,0,5,1,1,0,7,0,7
2020,"Impaired fasting glucose and development of chronic kidney disease in non-diabetic population: A Mendelian randomization study",20524897,"BMJ Open Diabetes Research and Care","8","1",0,0,0,0,0,0,0,0,0,0,0,0,0,0,0,0,0,0,0,0,0,0,1,1,1,4,0,7,0,7
2020,"The Uric Acid and Gout have No Direct Causality with Osteoarthritis: A Mendelian Randomization Study",22334718,"Journal of Rheumatic Diseases","27","2",0,0,0,0,0,0,0,0,0,0,0,0,0,0,0,0,0,0,0,0,0,0,2,4,0,1,0,7,0,7
2020,"Application of Mendelian Randomization to Investigate the Association of Body Mass Index with Health Care Costs",1552681X,"Medical Decision Making","40","2",0,0,0,0,0,0,0,0,0,0,0,0,0,0,0,0,0,0,0,0,0,1,3,1,1,1,0,7,0,7
2018,"Reassessing the association between circulating Vitamin D and IGFBP-3: Observational and Mendelian randomization estimates from independent sources",10559965,"Cancer Epidemiology Biomarkers and Prevention","27","12",0,0,0,0,0,0,0,0,0,0,0,0,0,0,0,0,0,0,0,0,0,2,1,2,1,1,0,7,0,7
2018,"Assessing the causal association between smoking behavior and risk of gout using a Mendelian randomization study",14349949,"Clinical Rheumatology","37","11",0,0,0,0,0,0,0,0,0,0,0,0,0,0,0,0,0,0,0,0,0,1,1,3,1,1,0,7,0,7
2018,"Phenomic impact of genetically-determined euthyroid function and molecular differences between thyroid disorders",20770383,"Journal of Clinical Medicine","7","10",0,0,0,0,0,0,0,0,0,0,0,0,0,0,0,0,0,0,0,0,2,1,4,0,0,0,0,7,0,7
2017,"The effect of birth weight on academic performance: Instrumental variable analysis",14766256,"American Journal of Epidemiology","185","9",0,0,0,0,0,0,0,0,0,0,0,0,0,0,0,0,0,0,0,2,0,0,0,1,2,2,0,7,0,7
2016,"Commentary: Mendelian randomization analysis identifies circulating Vitamin D as a causal risk factor for ovarian cancer",14643685,"International Journal of Epidemiology","45","5",0,0,0,0,0,0,0,0,0,0,0,0,0,0,0,0,0,0,0,1,1,1,3,1,0,0,0,7,0,7
2024,"Kidney Volume and Risk of Incident Kidney Outcomes",15333450,"Journal of the American Society of Nephrology","35","9",0,0,0,0,0,0,0,0,0,0,0,0,0,0,0,0,0,0,0,0,0,0,0,0,0,1,5,6,0,6
2024,"Causal association between circulating inflammatory cytokines and intracranial aneurysm and subarachnoid hemorrhage",14681331,"European Journal of Neurology","31","8",0,0,0,0,0,0,0,0,0,0,0,0,0,0,0,0,0,0,0,0,0,0,0,0,0,3,3,6,0,6
2024,"Association of blood lipid profiles and asthma: A bidirectional two-sample Mendelian randomization study",14691809,"Annals of Human Genetics","88","4",0,0,0,0,0,0,0,0,0,0,0,0,0,0,0,0,0,0,0,0,0,0,0,0,0,2,4,6,0,6
2024,"Metformin treatment reduces the incidence of osteoporosis: a two-sample Mendelian randomized study",14332965,"Osteoporosis International","35","6",0,0,0,0,0,0,0,0,0,0,0,0,0,0,0,0,0,0,0,0,0,0,0,0,0,4,2,6,0,6
2024,"Genetic Complexities of Cerebral Small Vessel Disease, Blood Pressure, and Dementia",25743805,"JAMA Network Open","7","5",0,0,0,0,0,0,0,0,0,0,0,0,0,0,0,0,0,0,0,0,0,0,0,0,0,3,3,6,0,6
2024,"Assessing the Role of Cortisol in Anxiety, Major Depression, and Neuroticism: A Mendelian Randomization Study Using SERPINA6/SERPINA1 Variants",26671743,"Biological Psychiatry Global Open Science","4","3",0,0,0,0,0,0,0,0,0,0,0,0,0,0,0,0,0,0,0,0,0,0,0,0,0,4,2,6,0,6
2024,"Heterogeneity of aging and mortality risk among individuals with hypertension: Insights from phenotypic age and phenotypic age acceleration",17604788,"Journal of Nutrition, Health and Aging","28","5",0,0,0,0,0,0,0,0,0,0,0,0,0,0,0,0,0,0,0,0,0,0,0,0,0,5,1,6,0,6
2024,"Causal effects of PM2.5 exposure on neuropsychiatric disorders and the mediation via gut microbiota: A Mendelian randomization study",10902414,"Ecotoxicology and Environmental Safety","275","",0,0,0,0,0,0,0,0,0,0,0,0,0,0,0,0,0,0,0,0,0,0,0,0,0,2,4,6,0,6
2024,"Human blood metabolites and risk of sepsis: A Mendelian randomization investigation",13652362,"European Journal of Clinical Investigation","54","4",0,0,0,0,0,0,0,0,0,0,0,0,0,0,0,0,0,0,0,0,0,0,0,0,0,4,2,6,0,6
2024,"Myasthenia gravis and five autoimmune diseases: a bidirectional Mendelian randomization study",15903478,"Neurological Sciences","45","4",0,0,0,0,0,0,0,0,0,0,0,0,0,0,0,0,0,0,0,0,0,0,0,0,0,4,2,6,0,6
2024,"Association of sleep traits with myopia in children and adolescents: A meta-analysis and Mendelian randomization study",10960260,"Preventive Medicine","180","",0,0,0,0,0,0,0,0,0,0,0,0,0,0,0,0,0,0,0,0,0,0,0,0,0,6,0,6,0,6
2024,"Causal Associations Between Gut Microbiota and Cerebrovascular Diseases",18788769,"World Neurosurgery","183","",0,0,0,0,0,0,0,0,0,0,0,0,0,0,0,0,0,0,0,0,0,0,0,0,0,3,3,6,0,6
2024,"Genetically determined blood pressure, antihypertensive medications, and risk of intracranial aneurysms and aneurysmal subarachnoid hemorrhage: A Mendelian randomization study",23969881,"European Stroke Journal","9","1",0,0,0,0,0,0,0,0,0,0,0,0,0,0,0,0,0,0,0,0,0,0,0,0,0,5,1,6,0,6
2024,"Dose-Response Associations of Lipid Traits with Coronary Artery Disease and Mortality",25743805,"JAMA Network Open","7","1",0,0,0,0,0,0,0,0,0,0,0,0,0,0,0,0,0,0,0,0,0,0,0,0,0,3,3,6,0,6
2024,"CXCR1 and CXCR2 are potential neutrophil extracellular trap-related treatment targets in ulcerative colitis: insights from Mendelian randomization, colocalization and transcriptomic analysis",16643224,"Frontiers in Immunology","15","",0,0,0,0,0,0,0,0,0,0,0,0,0,0,0,0,0,0,0,0,0,0,0,0,0,0,6,6,0,6
2024,"Genetic liability of gut microbiota for idiopathic pulmonary fibrosis and lung function: a two-sample Mendelian randomization study",22352988,"Frontiers in Cellular and Infection Microbiology","14","",0,0,0,0,0,0,0,0,0,0,0,0,0,0,0,0,0,0,0,0,0,0,0,0,0,3,3,6,0,6
2024,"The causal relationship between gut microbiota and lymphoma: a two-sample Mendelian randomization study",16643224,"Frontiers in Immunology","15","",0,0,0,0,0,0,0,0,0,0,0,0,0,0,0,0,0,0,0,0,0,0,0,0,0,3,3,6,0,6
2024,"To analyze the relationship between gut microbiota, metabolites and migraine: a two-sample Mendelian randomization study",1664302X,"Frontiers in Microbiology","15","",0,0,0,0,0,0,0,0,0,0,0,0,0,0,0,0,0,0,0,0,0,0,0,0,0,5,1,6,0,6
2024,"Inflammatory cytokine profiles in erectile dysfunction: a bidirectional Mendelian randomization",16643224,"Frontiers in Immunology","15","",0,0,0,0,0,0,0,0,0,0,0,0,0,0,0,0,0,0,0,0,0,0,0,0,0,4,2,6,0,6
2024,"Causal relationship between inflammatory cytokines and autoimmune thyroid disease: a bidirectional two-sample Mendelian randomization analysis",16643224,"Frontiers in Immunology","15","",0,0,0,0,0,0,0,0,0,0,0,0,0,0,0,0,0,0,0,0,0,0,0,0,0,4,2,6,0,6
2024,"Bacteroidaceae, Bacteroides, and Veillonella: emerging protectors against Graves’ disease",22352988,"Frontiers in Cellular and Infection Microbiology","14","",0,0,0,0,0,0,0,0,0,0,0,0,0,0,0,0,0,0,0,0,0,0,0,0,0,2,4,6,0,6
2024,"Genetic causal association between rheumatoid arthritis and periodontitis: a bidirectional two-sample Mendelian randomization analysis",14363771,"Clinical Oral Investigations","28","1",0,0,0,0,0,0,0,0,0,0,0,0,0,0,0,0,0,0,0,0,0,0,0,0,0,5,1,6,0,6
2023,"Causal relationship between sleep traits and cognitive impairment: A Mendelian randomization study",17565391,"Journal of Evidence-Based Medicine","16","4",0,0,0,0,0,0,0,0,0,0,0,0,0,0,0,0,0,0,0,0,0,0,0,0,0,5,1,6,0,6
2023,"Mendelian randomization reveals association between retinal thickness and non-motor symptoms of Parkinson’s disease",23738057,"npj Parkinson's Disease","9","1",0,0,0,0,0,0,0,0,0,0,0,0,0,0,0,0,0,0,0,0,0,0,0,0,0,4,2,6,0,6
2023,"Unbalanced bidirectional causal association between thyroid cancer and ER-positive breast cancer: should we recommend screening for thyroid cancer in breast cancer patients?",14712164,"BMC Genomics","24","1",0,0,0,0,0,0,0,0,0,0,0,0,0,0,0,0,0,0,0,0,0,0,0,0,0,2,4,6,0,6
2023,"Evaluating the risk of sepsis attributing to obesity: a two-sample Mendelian randomization study",14690756,"Postgraduate Medical Journal","99","1178",0,0,0,0,0,0,0,0,0,0,0,0,0,0,0,0,0,0,0,0,0,0,0,0,0,4,2,6,0,6
2023,"Gut microbiota and risk of polycystic ovary syndrome: Insights from Mendelian randomization",24058440,"Heliyon","9","12",0,0,0,0,0,0,0,0,0,0,0,0,0,0,0,0,0,0,0,0,0,0,0,0,0,5,1,6,0,6
2023,"Causal effects of gut microbiome on endometriosis: a two-sample mendelian randomization study",14726874,"BMC Women's Health","23","1",0,0,0,0,0,0,0,0,0,0,0,0,0,0,0,0,0,0,0,0,0,0,0,0,1,3,2,6,0,6
2023,"Causal associations between female reproductive behaviors and psychiatric disorders: a lifecourse Mendelian randomization study",1471244X,"BMC Psychiatry","23","1",0,0,0,0,0,0,0,0,0,0,0,0,0,0,0,0,0,0,0,0,0,0,0,0,0,3,3,6,0,6
2023,"No evident causal association between Helicobacter pylori infection and colorectal cancer: a bidirectional mendelian randomization study",20452322,"Scientific Reports","13","1",0,0,0,0,0,0,0,0,0,0,0,0,0,0,0,0,0,0,0,0,0,0,0,0,0,4,2,6,0,6
2023,"Investigating the causal interplay between sleep traits and risk of acute myocardial infarction: a Mendelian randomization study",17417015,"BMC Medicine","21","1",0,0,0,0,0,0,0,0,0,0,0,0,0,0,0,0,0,0,0,0,0,0,0,0,0,6,0,6,0,6
2023,"A causal relationship between antioxidants, minerals and vitamins and metabolic syndrome traits: a Mendelian randomization study",17585996,"Diabetology and Metabolic Syndrome","15","1",0,0,0,0,0,0,0,0,0,0,0,0,0,0,0,0,0,0,0,0,0,0,0,0,0,4,2,6,0,6
2023,"Understanding the relationship between circulating lipids and risk of chronic kidney disease: a prospective cohort study and large-scale genetic analyses",14795876,"Journal of Translational Medicine","21","1",0,0,0,0,0,0,0,0,0,0,0,0,0,0,0,0,0,0,0,0,0,0,0,0,0,4,2,6,0,6
2023,"Mendelian randomization analysis revealed potential metabolic causal factors for breast cancer",20452322,"Scientific Reports","13","1",0,0,0,0,0,0,0,0,0,0,0,0,0,0,0,0,0,0,0,0,0,0,0,0,0,4,2,6,0,6
2023,"Obesity and head and neck cancer risk: a mendelian randomization study",17558794,"BMC Medical Genomics","16","1",0,0,0,0,0,0,0,0,0,0,0,0,0,0,0,0,0,0,0,0,0,0,0,0,0,5,1,6,0,6
2023,"Vitamin D and idiopathic pulmonary fibrosis: a two-sample mendelian randomization study",14712466,"BMC Pulmonary Medicine","23","1",0,0,0,0,0,0,0,0,0,0,0,0,0,0,0,0,0,0,0,0,0,0,0,0,1,3,2,6,0,6
2023,"Causal association between major depressive disorder and coronary heart disease: a two-sample bidirectional mendelian randomization study",17558794,"BMC Medical Genomics","16","1",0,0,0,0,0,0,0,0,0,0,0,0,0,0,0,0,0,0,0,0,0,0,0,0,1,4,1,6,0,6
2023,"Association between periodontitis and temporomandibular joint disorders",14786362,"Arthritis Research and Therapy","25","1",0,0,0,0,0,0,0,0,0,0,0,0,0,0,0,0,0,0,0,0,0,0,0,0,1,4,1,6,0,6
2023,"A Mendelian randomization study of serum uric acid with the risk of venous thromboembolism",14786362,"Arthritis Research and Therapy","25","1",0,0,0,0,0,0,0,0,0,0,0,0,0,0,0,0,0,0,0,0,0,0,0,0,1,3,2,6,0,6
2023,"CARE as a wearable derived feature linking circadian amplitude to human cognitive functions",23986352,"npj Digital Medicine","6","1",0,0,0,0,0,0,0,0,0,0,0,0,0,0,0,0,0,0,0,0,0,0,0,0,0,6,0,6,0,6
2023,"Association between leptin and NAFLD: a two-sample Mendelian randomization study",2047783X,"European Journal of Medical Research","28","1",0,0,0,0,0,0,0,0,0,0,0,0,0,0,0,0,0,0,0,0,0,0,0,0,1,5,0,6,0,6
2023,"A Mendelian randomization study of genetic liability to post-traumatic stress disorder and risk of ischemic stroke",21583188,"Translational Psychiatry","13","1",0,0,0,0,0,0,0,0,0,0,0,0,0,0,0,0,0,0,0,0,0,0,0,0,0,4,2,6,0,6
2023,"Causal factors in primary open angle glaucoma: a phenome-wide Mendelian randomisation study",20452322,"Scientific Reports","13","1",0,0,0,0,0,0,0,0,0,0,0,0,0,0,0,0,0,0,0,0,0,0,0,0,0,5,1,6,0,6
2023,"Type 2 diabetes mellitus plays a protective role against osteoporosis --mendelian randomization analysis",14712474,"BMC Musculoskeletal Disorders","24","1",0,0,0,0,0,0,0,0,0,0,0,0,0,0,0,0,0,0,0,0,0,0,0,0,0,5,1,6,0,6
2023,"Association between circulating fatty acid metabolites and asthma risk: a two-sample bidirectional Mendelian randomization study",17558794,"BMC Medical Genomics","16","1",0,0,0,0,0,0,0,0,0,0,0,0,0,0,0,0,0,0,0,0,0,0,0,0,1,5,0,6,0,6
2023,"Causal relationships between serum matrix metalloproteinases and estrogen receptor-negative breast cancer: a bidirectional mendelian randomization study",20452322,"Scientific Reports","13","1",0,0,0,0,0,0,0,0,0,0,0,0,0,0,0,0,0,0,0,0,0,0,0,0,0,2,4,6,0,6
2023,"Effects of major depression and bipolar disorder on erectile dysfunction: a two-sample mendelian randomization study",17558794,"BMC Medical Genomics","16","1",0,0,0,0,0,0,0,0,0,0,0,0,0,0,0,0,0,0,0,0,0,0,0,0,1,5,0,6,0,6
2023,"Associations between body circumference and testosterone levels and risk of metabolic dysfunction-associated fatty liver disease: a mendelian randomization study",14712458,"BMC Public Health","23","1",0,0,0,0,0,0,0,0,0,0,0,0,0,0,0,0,0,0,0,0,0,0,0,0,1,2,3,6,0,6
2023,"Genetic predisposition to smoking in relation to the risk of frailty in ageing",20452322,"Scientific Reports","13","1",0,0,0,0,0,0,0,0,0,0,0,0,0,0,0,0,0,0,0,0,0,0,0,0,1,4,1,6,0,6
2023,"Metabolome-wide association study on physical activity",20452322,"Scientific Reports","13","1",0,0,0,0,0,0,0,0,0,0,0,0,0,0,0,0,0,0,0,0,0,0,0,0,1,3,2,6,0,6
2023,"The bidirectional relationship between Alzheimer's disease (AD) and epilepsy: A Mendelian randomization study",21623279,"Brain and Behavior","13","11",0,0,0,0,0,0,0,0,0,0,0,0,0,0,0,0,0,0,0,0,0,0,0,0,0,4,2,6,0,6
2023,"Causal associations between gut microbiota and sepsis: A two-sample Mendelian randomization study",13652362,"European Journal of Clinical Investigation","53","11",0,0,0,0,0,0,0,0,0,0,0,0,0,0,0,0,0,0,0,0,0,0,0,0,2,3,1,6,0,6
2023,"Exploring the cross-cancer effect of smoking and its fingerprints in blood DNA methylation on multiple cancers: A Mendelian randomization study",10970215,"International Journal of Cancer","153","8",0,0,0,0,0,0,0,0,0,0,0,0,0,0,0,0,0,0,0,0,0,0,0,0,0,5,1,6,0,6
2023,"The impact of sociodemographic status on the association of classical cardiovascular risk factors with coronary artery disease: a stratified Mendelian randomization study",18785921,"Journal of Clinical Epidemiology","162","",0,0,0,0,0,0,0,0,0,0,0,0,0,0,0,0,0,0,0,0,0,0,0,0,2,3,1,6,0,6
2023,"Causal association of cardiovascular disease with erectile dysfunction: a two-sample bidirectional Mendelian randomization analysis",20472927,"Andrology","11","7",0,0,0,0,0,0,0,0,0,0,0,0,0,0,0,0,0,0,0,0,0,0,0,0,0,4,2,6,0,6
2023,"Mendelian randomization study shows a causal effect of asthma on chronic obstructive pulmonary disease risk",19326203,"PLoS ONE","18","9 September",0,0,0,0,0,0,0,0,0,0,0,0,0,0,0,0,0,0,0,0,0,0,0,0,1,2,3,6,0,6
2023,"Causal Effect of the 25-Hydroxyvitamin D Concentration on Cerebral Small Vessel Disease: A Mendelian Randomization Study",15244628,"Stroke","54","9",0,0,0,0,0,0,0,0,0,0,0,0,0,0,0,0,0,0,0,0,0,0,0,0,0,6,0,6,0,6
2023,"The causal role of circulating amino acids on neurodegenerative disorders: A two-sample Mendelian randomization study",14714159,"Journal of Neurochemistry","166","6",0,0,0,0,0,0,0,0,0,0,0,0,0,0,0,0,0,0,0,0,0,0,0,0,0,4,2,6,0,6
2023,"Correlation between obstructive sleep apnea and cerebral small vessel disease: a mendelian randomization study",20929293,"Genes and Genomics","45","9",0,0,0,0,0,0,0,0,0,0,0,0,0,0,0,0,0,0,0,0,0,0,0,0,0,4,2,6,0,6
2023,"Falsification of the instrumental variable conditions in Mendelian randomization studies in the UK Biobank",15737284,"European Journal of Epidemiology","38","9",0,0,0,0,0,0,0,0,0,0,0,0,0,0,0,0,0,0,0,0,0,0,0,0,1,3,2,6,0,6
